Articles,Prices,InStocks,N_colors,N_sizes
Top tendance avec chaîne,14.28,True,9,3
Robe longue tendance à col...,40.8,True,6,1
Jupe longue tendance effet...,33.6,True,5,1
Robe d'été tendance en...,30.0,True,2,1
Combinaison tendance à...,21.84,True,5,1
Combinaison tendance à...,31.2,True,6,1
Ensemble d'été tendance -...,43.2,True,3,1
Ensemble d'été fashion...,36.0,True,5,2
Top court tendance à...,20.4,True,4,1
Haut bustier tendance avec...,18.0,True,5,1
Chemisier élégant et...,21.84,True,4,1
Short d'été tendance avec...,10.8,True,2,2
Leggings court tendance,5.88,True,4,3
Combinaison tendance à...,26.4,True,8,2
Combinaison d'été fashion,20.16,True,2,2
Short d'été tendance avec...,10.8,True,2,1
Pantalon évasé fashion en...,31.2,True,3,1
Robe de plage tendance,28.8,True,3,1
Combinaison d'été fashion...,19.2,True,6,1
Haut court à bretelles...,10.92,True,4,1
Haut à bretelles corset...,19.2,True,6,1
Combinaison tendance avec...,23.52,True,2,1
"Mini robe à bretelles,...",21.84,True,6,1
Robe tendance en soie avec...,23.52,True,5,1
Robe moulante fashion avec...,26.4,True,6,3
Combinaison tendance avec...,18.48,True,4,1
Jupe de plage tendance avec...,10.92,True,3,1
Crop top fashion à épaules...,8.4,True,3,1
Top fashion à bretelles...,9.24,True,5,6
Robe mi-longue fashion à...,33.6,True,4,5
Robe moulante tendance à...,33.6,True,4,5
Combinaison tendance...,43.2,True,4,1
Jeans coupe slim fashion,21.84,True,1,1
Jeans déchiré fashion...,20.16,True,1,1
Jeans slim taille haute...,20.16,True,1,1
Combinaison sexy skinny...,26.88,True,5,1
Robe fashion à bretelles...,21.0,True,5,1
Robe en maille fashion avec...,18.0,True,7,3
Haut court à manches...,12.0,True,4,1
Boléro tendance manches...,28.8,True,4,1
Chemisier court tendance,23.52,True,6,1
Haut court tendance,15.12,True,2,1
Pantalon tendance avec fente,16.8,True,4,1
Robe chemise fashion en...,33.6,True,10,2
Cardigan long fashion à...,28.56,True,6,1
Robe mi-longue fashion en...,26.88,True,4,1
Blouse courte effet soie...,24.0,True,4,1
Culotte en dentelle,2.52,True,8,1
150 robes de notre collection,1620.0,True,2,1
150 pulls de notre collection,1620.0,True,4,1
450 pièces de produits...,2700.0,True,3,1
150 pièces de produits...,1080.0,True,3,1
500 robes de notre collection,4200.0,True,3,1
750 pièces de produits...,2268.0,True,3,1
750 pulls de notre collection,5400.0,True,3,2
750 robes de notre collection,5400.0,True,2,2
500 pulls de notre collection,4200.0,True,1,2
Haut court tendance,12.6,True,3,1
Top court tendance à...,10.2,True,3,1
Chemisier court tendance à...,18.48,True,1,2
Haut court Carmen à volants...,18.48,True,1,2
Ensemble en dentelle 3 pièces,16.8,True,1,1
Ensemble en dentelle 3 pièces,22.68,True,2,1
Cardigan tendance à rayures...,15.0,True,2,2
Body échancré tendance à...,15.6,True,7,5
Ensemble 2 pièces tendance-...,37.2,True,1,5
Pull tendance à dos ouvert,15.96,True,3,4
Pull court tendance à...,28.8,True,4,3
Jeans coupe slim classique,20.16,True,2,1
Jeans taille haute avec...,21.84,True,1,4
Pantalon taille haute...,21.84,True,8,4
Veste d'hiver en simili...,56.28,True,3,4
Blouson aviateur fashion en...,43.68,True,3,5
Leggings en simili cuir...,15.12,True,3,4
Pantalon de sport tendance...,13.44,True,1,2
Manteau d'hiver courte en...,75.6,True,1,1
Manteau confortable en...,65.52,True,4,2
Manteau fashion en simili...,62.16,True,4,3
Mini-jupe boutonnée tendance,18.48,True,5,5
Pull côtelé tendance à col...,15.12,True,2,5
Ensemble sexy,15.96,True,3,1
Survêtement sport tendance...,21.0,True,3,1
Ensemble sport tendance,30.24,True,4,1
Jeans fashion push-up look usé,21.84,True,5,1
Jeans skinny taille haute,21.84,True,5,1
Mini-robe fashion à une épaule,23.52,True,5,3
Robe fashion à volants...,24.36,True,3,1
Mini robe moulante avec...,21.84,True,4,1
Manteau en simili cuir...,42.0,True,3,1
Mini-jupe en maille cache-cœur,11.4,True,3,1
Mini-jupe fashion en simili...,21.0,True,5,4
Mini jupe tendance à volants,15.12,True,5,1
Robe en maille déchirée...,23.52,True,3,1
Robe mi-longue fashion en...,30.24,True,5,1
Robe en maille élégante,18.0,True,3,1
Haut court fashion,10.08,True,5,1
Crop top fashion,12.6,True,6,1
Bas tendance,9.24,True,4,1
Mini robe moulante fashion...,22.68,True,1,1
Robe moulante sexy,20.16,True,1,4
Robe moulante fashion en...,25.2,True,3,1
Mini robe tendance avec...,16.8,True,3,1
Chemisier à volants à...,14.28,True,1,5
Manteau fashion avec ceinture,40.32,True,1,5
Combinaison sexy avec...,43.68,True,3,1
Robe en maille tendance...,25.2,True,4,4
Crop top fashion en simili...,18.48,True,3,3
Jeans skinny tendance...,21.84,True,4,4
Jeans déchiré tendance...,21.84,True,1,4
Bottines sexy à lacets avec...,67.2,True,2,4
Boucles d'oreilles tendance...,10.08,True,3,1
Mini jupe fashion avec...,23.52,True,4,5
Mini robe fashion à volants...,26.88,True,5,4
Robe fashion en satin avec...,26.88,True,6,4
Mini robe fashion en satin,23.52,True,6,1
Mini robe fashion à manches...,25.2,True,6,1
Mini robe fashion,23.52,True,4,1
Jeans tendance look usé,21.84,True,6,1
Pantalon fashion en faux...,30.24,True,3,1
Robe fashion en faux cuir,26.88,True,3,1
Top court tendance avec...,13.2,True,5,1
Crop top fashion avec découpes,13.2,True,5,3
Robe fashion en maille...,21.84,True,4,1
Pull fashion à col en V,20.16,True,3,1
Pull côtelé sexy à col roulé,19.32,True,4,1
Robe tendance,26.88,True,5,1
Robe mi-longue tendance en...,28.56,True,4,5
Short fashion taille haute,16.8,True,2,1
Mini robe tendance avec...,18.48,True,2,1
Robe fashion avec fente et...,21.84,True,2,3
Body fashion à une épaule...,23.52,True,2,1
Body fashion Koucla,21.84,True,4,1
Manteau fashion en simili...,70.56,True,7,1
Crop top fashion en maille...,17.64,True,1,1
Pull court fashion à col en V,15.96,True,2,1
Haut corset fashion en...,18.48,True,3,1
Boucles d'oreilles tendance,3.36,True,5,1
Boucles d'oreilles tendance,3.36,False,4,1
Boucles d'oreilles...,3.36,True,3,1
Boucles d'oreilles tendance...,4.2,True,1,1
Pull court fashion en...,14.4,True,1,1
Manteau tendance oversize...,42.0,True,1,1
Manteau d'hiver Parisian...,50.4,True,5,5
Robe fashion dos nu effet daim,20.16,True,4,5
Robe dos nu en maille fine...,23.52,True,4,5
Mini robe de soirée avec...,28.56,True,4,1
Chemisier élégant aspect...,21.84,True,2,4
Pull oversize en tricot...,20.16,True,2,3
Jeans fashion taille haute...,21.84,True,4,3
Jeans taille haute fashion...,21.84,True,3,4
Jeans taille haute push-up...,21.84,True,6,3
Robe de soirée tendance...,30.24,True,5,1
Mini robe fashion en satin...,28.56,True,1,1
Robe midi fashion en satin...,26.88,True,3,1
Mini robe fashion en satin...,25.2,True,2,1
Jupe-short fashion taille...,20.16,True,2,1
Short taille haute fashion...,13.2,True,5,1
Cardigan fashion à motif...,18.0,False,6,1
Pull tricotée Christmas Time,21.84,True,3,1
Haut court style bandeau...,12.6,True,2,1
Top court fashion à manches...,21.0,True,5,1
Collants tendance,5.04,True,2,1
Boucles d'oreilles à...,8.4,True,4,4
Boucles d'oreilles...,10.08,True,2,1
Boucles d'oreilles fashion...,10.08,True,5,1
Pull tendance en maille...,15.0,True,5,4
Cardigan en tricot douillet,16.2,True,4,4
Veste tendance à carreaux,24.0,True,3,1
Combinaison fashion,30.24,True,5,4
Jupe fashion effet mouillé...,16.8,True,5,1
Robe de chambre fashion...,21.84,True,2,3
Mini robe élégante en satin,28.56,True,2,1
Pantalon sexy en latex,25.2,True,5,1
Pantalon fashion évasé avec...,23.52,True,2,5
Body en simili cuir avec...,20.16,True,3,1
Crop top fashion en simili...,13.44,True,3,3
Haut de soirée fashion en...,18.48,True,2,4
Crop top fashion en satin...,23.52,True,4,1
Robe fashion en maille fine...,25.2,True,4,1
Combinaison tendance à...,28.56,True,4,1
Manteau oversize d'hiver...,39.6,True,5,4
Legging fashion taille...,15.12,True,2,1
Combinaison fashion look...,25.2,True,5,3
Short tendance en simili...,23.52,True,5,4
Robe de soirée tendance...,25.2,True,4,3
Mini robe avec laçage et...,25.2,True,4,1
Pantalon en cuir taille...,21.84,True,5,1
Haut court tendance aspect...,18.48,True,2,1
Robe fashion aspect satin...,25.2,True,2,4
Body tendance effet satin,21.84,True,3,3
Crop top tendance en simili...,15.96,True,2,3
Pull fashion look portefeuille,15.6,True,3,4
Robe en maille fashion à...,19.2,True,3,3
Pull court look oversize,13.8,True,3,3
Combinaison fashion,30.24,True,7,1
Mini jupe fashion look...,11.76,True,5,1
Jupe taille haute en simili...,18.48,True,5,4
Short tendance avec poches...,21.84,True,4,4
Short tendance taille haute...,21.0,True,6,1
Robe fashion en simili cuir,25.2,True,4,1
Robe fashion en simili cuir...,25.2,True,5,1
Robe de soirée fashion...,23.52,True,6,1
Veste d'hiver tendance avec...,36.0,True,7,4
Pantalon évasé taille haute...,25.2,True,2,2
Sweat à capuche court tendance,15.12,False,5,2
Body tendance en latex près...,20.16,True,3,4
Cardigan en maille tendance...,16.8,True,6,1
Pull court en maille fine,13.2,True,5,4
Combinaison fashion à...,31.92,True,4,2
Leggings fashion,16.8,True,6,2
Leggings fashion en simili...,16.8,True,4,1
Combinaison fashion avec...,27.72,True,3,5
Robe de soirée fashion à...,21.84,True,1,2
Mini robe de soirée fashion,23.52,True,1,1
Soutien-gorge en dentelle,6.72,True,2,3
Ensemble sportwear deux...,21.84,True,5,4
Cardigan moelleux à...,18.0,True,6,4
Combinaison fashion en...,30.24,True,6,4
Leggings thermique fashion...,16.8,True,5,4
Short fashion en simili cuir,23.52,True,6,1
Mini robe bandeau en simili...,21.84,True,3,2
Pantalon évasé fashion,21.84,True,5,2
Pantalon évasé fashion en...,23.52,True,1,1
Robe de soirée fashion avec...,25.2,True,2,3
Pantalon évasé taille haute...,21.84,True,5,1
Ensemble sportswear 2 pièces,23.52,True,2,2
Ensemble 2 pièces tendance,25.2,True,3,4
Ensemble 3 pièces fashion,24.36,True,4,1
Mini robe tendance avec fleurs,28.56,True,3,5
Mini robe fashion look latex,25.2,True,4,1
Mini robe fashion effet...,23.52,True,1,3
Mini robe fashion,25.2,True,1,1
Pantalon taille haute...,21.84,True,1,1
Ensemble 2 pièces à paillettes,26.04,True,1,5
Combinaison fashion effet...,28.56,True,1,5
Mini robe fashion,25.2,True,2,5
Robe tendance look satin,23.52,True,1,5
Robe tendance imprimé animal,23.52,True,5,5
Mini robe à encolure avec...,21.84,True,5,5
Jeans évasé effet usé,23.52,True,3,5
Jeans taille haute tendance...,23.52,True,5,1
Jeans taille haute tendance...,23.52,True,4,1
Jeans taille haute blanc...,23.52,True,7,3
Jeans taille haute tendance...,25.2,True,2,4
Jeans taille haute tendance...,23.52,True,5,1
Jeans tendance délavé clair,25.2,True,1,1
Chemisier fashion aspect satin,21.0,True,4,4
Blazer court à nouer,23.52,True,1,1
Robe blazer tendance,31.92,True,4,1
Crop top fashion à...,16.8,True,5,1
Crop top fashion imprimé...,15.12,True,2,5
Robe fashion en maille fine...,26.88,True,5,4
Salopette fashion avec...,36.96,True,6,4
Mini jupe fashion imprimé...,16.8,True,7,4
Mini robe fashion à manches...,21.84,True,6,1
Robe fashion à manches...,22.68,True,7,1
Jeans taille haute fashion...,23.52,True,1,1
Pantalon fashion imprimé...,23.52,True,7,1
Pantalon fashion en latex à...,25.2,True,9,1
Robe chemise effet mouillé...,28.56,True,5,5
Robe chemise ajustée,26.88,True,2,1
Gilet tendance,15.12,False,5,1
Pull court en maille fine...,15.12,True,6,1
Pull court tendance avec noeud,16.8,True,2,3
Pull en maille V-Cut...,15.96,True,3,1
Jeans skinny taille haute...,21.84,True,2,2
Pull côtelé court avec laçage,15.96,True,4,4
Pull tendance effet cache-cœur,15.12,True,2,1
Chemisier tendance aspect...,18.48,True,2,3
Robe de soirée tendance...,26.88,True,5,3
Crop top manches longues...,18.48,True,5,3
Ensemble deux pièces,25.2,True,6,4
Combinaison manches longues...,36.96,True,6,1
Mini robe fashion Koucla à...,25.2,True,6,1
Robe en simili cuir sexy...,21.84,True,3,2
Robe fashion à bretelles...,23.52,True,2,2
Robe fashion à bretelles en...,25.2,True,5,2
Pantalon fashion évasé...,23.52,True,5,1
Crop top tendance à nouer,10.92,True,5,4
Veste tendance à boutons,23.52,True,3,1
Ensemble 2 pièces Sporty,22.68,True,4,2
Ensemble 2 pièces veste...,21.84,True,1,1
Ensemble 2 pièces tendance...,21.84,True,1,1
Mini jupe tendance effet...,16.8,True,1,3
Mini jupe tendance avec...,18.48,True,1,1
Robe sweat à capuche fashion,20.16,True,2,5
Leggings taille haute...,8.4,True,5,5
Mini robe tendance,21.84,True,5,5
Robe scintillante fashion,18.48,True,5,4
Robe fashion à un bras,23.52,True,5,1
Mini robe fashion à...,21.84,True,6,1
Jeans boy friend tendance,21.0,True,5,1
Jeans taille haute look usé,20.16,True,4,4
Jeans taille haute basique...,20.16,True,5,2
Pantalon taille haute...,16.8,True,6,1
Robe de soirée fashion en...,30.24,True,5,3
Crop top à manches longues...,16.8,True,2,1
Combinaison printemps...,23.52,True,3,1
Combi-pantalon fashion,23.52,True,1,1
Leggings sportif à rayures...,8.4,True,7,1
Jupe-short fashion avec...,18.48,True,6,1
Robe fashion aspect latex...,30.24,True,4,4
Crop top asymétrique fashion,10.92,True,6,1
Top sexy fashion aspect...,15.96,True,4,3
Crop top fashion à...,12.6,True,2,1
Haut fashion en simili cuir...,12.6,True,2,2
Combinaison fashion à un...,30.24,True,7,1
Salopette à nouer dans le dos,30.24,True,4,2
Manteau fashion aspect cuir...,45.36,True,6,2
Leggings tendance,10.92,True,6,2
Robe portefeuille fashion à...,25.2,True,2,1
Leggings tendance taille haute,10.92,True,5,2
Crop top fashion avec...,18.48,True,4,1
Ensemble 2 pièces fashion,26.88,True,5,3
Ensemble 2 pièces fashion,25.2,True,6,1
Ensemble 2 pièces fashion,16.8,True,5,1
Mini jupe taille haute...,21.84,True,3,1
Leggings fashion,8.4,True,6,2
Leggings fashion avec effet...,11.76,True,6,1
Short tendance look usé,22.68,True,5,2
Mini-robe fashion à manches...,22.68,True,1,2
Robe t-shirt tendance effet...,18.48,True,1,3
Robe mi-longue tendance...,25.2,True,2,5
Jogger sportif avec imprimé,10.92,True,4,5
Body basique tendance,14.28,True,5,3
Compensées fashion,31.92,True,5,1
Jogger tendance 'West Coast',10.92,True,5,1
Jogging taille haute,10.92,True,5,1
Compensées tendance,49.2,True,4,1
Short look motard,7.56,True,5,1
Jeans push-up taille basse...,21.0,True,5,1
Jeans fashion look usé,23.52,True,7,3
Robe mi-longue fashion en...,25.2,True,5,1
Blazer printanier tendance...,31.92,True,5,1
Mini robe fashion avec imprimé,26.4,True,3,1
Mini robe fashion à manches...,30.0,True,5,1
Mini-robe fashion à...,33.6,True,4,4
Crop top bandeau fashion...,14.28,True,3,3
Haut à encolure fashion,15.12,True,2,2
Haut bandeau fashion en...,20.16,True,2,3
Crop top fashion avec découpes,13.44,True,2,2
Crop top avec détail de chaîne,13.44,True,4,1
Crop top fashion à un bras,15.12,True,4,1
Escarpins talons hauts,37.2,True,1,5
Mini jupe fashion avec chaîne,15.12,True,2,4
Jupe fashion en simili cuir,18.48,True,3,4
Pantalon taille haute...,9.24,True,2,4
Pantalon taille haute...,9.24,True,2,4
Pantalon taille haute...,10.08,True,1,5
Pantalon évasé fashion...,13.44,True,1,5
Mini robe fashion en satin,21.84,True,1,5
Mini robe fashion à épaules...,24.36,True,3,1
Jeans taille haute tendance...,23.52,True,5,1
Ensemble lingerie 2 pièces,15.96,True,5,4
Ensemble lingerie 2 pièces,15.12,True,3,2
Ensemble lingerie 2 pièces,15.12,True,5,1
Ensemble lingerie 2 pièces,15.12,True,7,1
Jeans look usé tendance,22.68,True,4,3
Jeans tendance incontournable,22.68,True,5,2
Jeans taille haute effet usé,21.84,True,4,1
Robe simili cuir avec fente,30.24,True,3,2
Crop top tendance à bretelles,10.92,True,4,1
Jupe-short avec boutons...,16.8,True,3,1
Combinaison d'été à épaules...,15.12,True,4,2
Salopette d'été tendance...,28.56,True,2,1
Kimono tendance,25.2,True,4,1
Pantalon d'été taille haute...,9.24,True,4,3
Pantalon d'été taille haute...,9.24,True,3,4
Jupe-short taille haute,19.32,True,3,5
Robe longue tendance au...,15.96,True,5,4
Mini robe à bretelles avec...,23.52,True,5,4
Mini robe à épaules...,28.56,True,5,4
Robe imprimé floral,23.52,True,4,5
Mini robe bandeau avec imprimé,21.84,True,4,3
Mini robe fashion,23.52,True,4,1
Kimono tendance,31.92,True,3,2
Bikini tendance,15.96,True,4,2
Bikini tendance,15.96,True,1,5
Bikini tendance,15.96,True,3,4
Bikini tendance,15.96,True,5,1
Bikini tendance,15.96,True,4,1
Bikini tendance,15.96,True,5,3
Pantalon taille haute...,9.24,True,5,4
Combinaison tendance dos...,26.88,True,5,1
Mini robe fashion avec...,16.8,True,3,3
Robe tendance imprimé,16.8,True,3,2
Jeans évasé taille haute...,21.84,True,5,5
Bikini tendance,15.12,True,4,5
Bikini tendance,15.96,True,3,3
Bikini tendance fashion,16.8,True,1,4
Bikini fashion,15.96,True,1,4
Crop top tendance froncé,15.12,True,3,2
Haut tendance à épaules...,15.96,True,4,2
Top fashion look latex,15.12,True,3,3
Jupe look latex,15.12,True,3,2
Combinaison à bretelles...,30.24,True,4,2
Pantalon d'été taille haute...,9.24,True,4,3
Pantalon d'été taille haute...,9.24,True,3,2
Short en jeans taille haute,18.48,True,5,2
Short en jeans taille haute,18.48,True,4,2
Jupe latex look,26.88,True,3,2
Jupes-shorts à taille haute...,16.8,True,4,2
Jupe-short tendance Koucla...,21.0,True,5,5
Combinaison à épaules...,16.8,True,3,5
Robe longue à encolure...,15.96,True,4,3
Pantalon d'été taille haute...,8.4,True,1,2
Pantalon taille haute...,9.24,True,2,2
Short taille haute tendance...,6.72,True,2,2
Short taille haute tendance...,7.56,True,3,1
Short taille haute d'été...,6.72,True,3,2
Robe longue à épaules...,16.8,True,2,2
Robe tendance,16.8,True,4,3
Robe d'été tendance avec...,16.8,True,1,3
Robe cache-cœur tendance d'été,18.48,True,3,3
Short en jeans taille haute,21.0,True,4,1
Short en jeans taille haute,20.16,True,4,2
Crop Top simili cuir...,16.8,True,4,2
Combinaison d'été fashion à...,14.28,True,3,2
Combinaison fashion avec...,14.28,True,3,3
Combinaison tendance avec...,14.28,True,4,3
Combinaison fashion avec...,22.68,True,3,3
Combinaison avec imprimé...,14.28,False,2,3
Combinaison tendance,13.44,True,2,3
Pantalon taille haute...,8.4,True,1,3
Pantalon taille haute...,9.24,True,1,2
Pantalon tendance taille...,8.4,True,1,1
Combinaison bandeau fashion...,11.76,True,2,4
Combinaison tendance à...,14.28,True,3,5
Combinaison à bretelles...,10.92,True,4,5
Short d'été tendance à...,6.72,True,1,1
Short d'été tendance avec...,6.72,True,1,2
Short d'été taille haute...,7.56,True,1,4
Short d'été tendance avec...,6.72,True,6,2
Short d'été tendance à...,7.56,True,4,2
Short d'été taille haute...,6.72,True,6,1
Shorts d'été tendance avec...,6.72,True,6,1
Jupe-short taille haute...,13.44,True,4,5
Mini robe fashion,20.16,True,5,5
Combinaison/Robe avec fente,30.24,True,3,5
Short en jeans basique...,20.16,True,1,5
Short en jeans taille haute...,20.16,True,1,5
Mini robe look satiné à nouer,21.0,True,1,5
Crop top cache-cœur fashion...,9.24,True,1,3
Shorts fashion en simili...,9.24,True,1,4
Robe longue look tendance...,21.84,True,1,1
Robe longue tendance avec...,21.84,True,4,1
Robe longue fashion Koucla...,28.56,True,5,1
Robe longue été fashion...,30.24,True,4,1
Short taille haute fashion...,20.16,True,4,2
Short en jeans look usé,21.84,True,3,2
Short en jeans taille haute,21.84,True,4,1
Short en jeans look usé...,21.84,True,1,2
Short en jeans fashion...,20.16,True,3,1
Short en jeans look usé...,21.84,True,6,1
Maillot de bain monokini...,15.12,True,6,2
Maillot de bain monokini...,12.6,True,3,2
Crop top fashion à Manches...,13.44,True,8,4
Top court tendance effet...,13.44,True,4,4
Top latina tendance à...,20.16,True,3,4
Crop top d'été fashion...,23.52,True,5,5
Crop top cache-cœur...,9.24,True,3,4
Crop top cache-cœur fashion...,9.24,True,4,4
Robe fashion Koucla effet...,18.48,True,3,5
Maxi robe d'été tendance...,21.84,True,4,3
Mini robe à épaules...,21.84,True,3,1
Robe longue Koucla look...,30.24,True,5,1
Mini robe d'été tendance...,15.12,True,4,1
Robe d'été tendance avec...,15.12,True,5,3
Bikini 2 pièces tendance...,13.44,True,5,4
Bikini 2 pièces tendance...,16.8,True,4,1
Bikini 2 pièces tendance...,15.96,True,2,2
Bikini 2 pièces tendance...,15.96,True,1,2
Bikini 2 pièces tendance...,15.96,True,4,2
Bikini 2 pièces tendance...,15.96,True,3,1
Bikini 2 pièces tendance...,15.96,True,4,1
Bikini 2 pièces tendance...,14.28,True,5,1
Robe fashion à Paillettes...,16.8,True,5,1
Top fashion en satin avec...,15.12,True,3,2
Crop top tendance à épaules...,15.12,True,2,2
Crop top simili cuir...,16.8,True,5,1
Jupe crayon tendance KouCla,15.96,True,4,1
Combinaison tendance...,23.52,True,3,1
Robe longue tendance 3en1...,15.12,True,4,5
Robe d'été tendance avec...,16.8,True,1,4
Mini robe tendance à nouer,17.64,True,5,4
Robe tendance aspect satin...,18.48,True,2,5
Longue robe avec fente,23.52,True,1,5
Kimono de plage avec de la...,30.24,True,5,4
Robe longue fashion en...,23.52,True,1,4
Robe d'été tendance à...,14.28,True,3,5
Mini robe tendance à...,13.44,True,4,1
Pantalon taille haute d'été...,23.52,True,2,1
Top court d'été tendance,22.68,True,1,5
Crop top tendance satin...,15.12,True,2,5
Short en jeans taille haute,19.32,True,6,1
Short en jeans taille haute...,21.84,True,1,1
Short taille haute avec poches,16.8,True,1,1
Short en jeans taille haute,21.84,True,5,1
Short en jeans taille haute...,18.48,True,3,1
Jupe-short en jeans taille...,21.84,True,6,3
Jupe-short en jeans taille...,23.52,True,5,2
Short look usé,19.32,True,2,1
Robe longue latina avec...,31.92,True,4,2
Superbe robe longue d'été...,31.92,True,6,1
Jeans tendance au look usé,21.84,True,5,1
Jeans tendance au look usé,21.84,True,5,1
Crop top tendance look...,18.48,True,5,4
Crop top crocheté tendance,14.28,True,4,1
Crop top fashion à paillettes,15.12,True,5,1
Combinaison d'été tendance...,30.24,True,1,1
Kimono tendance,25.2,True,6,2
Pantalon thermique évasé en...,16.8,True,6,1
Pantalon taille haute...,12.6,True,5,5
Combinaison fashion à...,20.16,True,6,1
Short tendance Gym-Sport,10.08,True,5,5
Robe mi-longue basique...,19.32,True,2,5
Robe bandeau fashion,23.52,True,4,5
Body bandeau fashion avec...,15.12,True,1,4
Combinaison fashion,31.92,True,1,5
Crop top crocheté tendance,13.44,True,1,5
Crop top manches courtes à...,10.08,True,2,4
Combinaison tendance à...,23.52,True,1,1
Pantalon Must-Have Basic...,12.6,True,1,1
Combinaison fashion avec...,20.16,True,2,1
Short en jeans taille haute...,15.12,True,3,2
Robe mi-longue tendance...,26.04,True,4,2
Jeans évasé taille haute blanc,21.84,True,5,3
Jeans évasé taille haute...,21.84,True,4,2
Jeans évasé délavé fashion...,21.84,True,5,1
Jeans style usé taille...,21.84,True,2,1
Short en jeans taille haute...,16.8,True,4,5
Jeans skinny taille haute...,21.84,True,3,5
Bikini Brésilien sexy,18.48,True,5,5
Crop top sexy à nouer,7.56,True,1,1
Crop top fashion,10.08,True,1,4
Crop top basique tendance,9.24,True,1,4
Ensemble 2 pièces gogo,14.28,True,6,4
Short taille haute sexy,9.24,True,2,3
Shorts en jean taille haute...,21.84,True,1,1
Mini robe sexy avec découpe,19.32,True,1,1
Robe d'été sexy avec fente...,23.52,True,3,1
Robe d'été sexy avec fente...,23.52,True,1,5
Jeans push up taille haute...,20.16,True,4,4
Jupe en jeans sexy taille...,20.16,True,4,1
Short en jeans push up...,17.64,True,1,3
Pantalon évasé taille haute...,12.6,True,3,1
Bikini Brésilien sexy,18.48,True,4,1
Bikini tendance,18.48,True,1,1
Monokini tour de cou avec...,21.0,True,3,1
Bikini tendance,18.48,True,7,1
Combinaison avec dentelle,28.56,True,2,1
Ensemble 2 pièces tendance,28.56,True,3,1
Combinaison à épaules...,19.32,True,5,1
Short en jeans style...,21.84,True,7,1
Short en jeans taille haute...,18.48,True,5,1
Short de cycliste sportif à...,7.56,True,5,1
Shorts look usé tendance,21.84,True,5,2
Tellement Sexy... Robe...,18.48,True,4,1
Pantalon évasé taille haute...,14.28,True,5,2
Ensemble 2 pièces sexy avec...,31.92,True,5,1
Jupe en simili cuir...,16.8,True,4,1
Pull sexy à épaules...,21.84,True,5,1
Pull col roulé basique sans...,13.44,True,4,1
Combinaison tendance à...,33.6,True,5,1
Robe asymétrique tendance...,24.36,True,5,1
Mini robe tendance en maille,21.84,True,6,1
Mini robe tendance avec strass,25.2,True,13,1
Robe de gala tendance en satin,38.64,True,6,1
Pantalon taille haute...,10.08,True,4,3
Jupe effet mouillé froncée...,15.12,True,5,1
Ensemble 2 pièces sport :...,34.8,True,5,5
Ensemble 2 pièces tendance,33.6,True,3,3
Pull douillet à col roulé,23.52,True,4,2
Pull court tendance,20.16,True,1,2
Robe sexy en tricot à...,22.68,True,3,1
Pull à col roulé Sexy Must...,15.12,True,6,4
Cardigan en grosse maille sexy,57.12,True,6,2
Pull sexy à épaules dénudées,20.16,True,5,2
Robe chemisier sexy avec...,26.88,True,3,1
Mini robe sexy à manches...,20.16,True,6,1
Robe simili cuir sexy...,25.2,True,6,1
Tellement Sexy - Robe...,25.2,True,4,1
Jeans skinny taille haute...,21.84,True,5,1
Jeggings taille haute évasé,16.8,True,7,1
Pantalon taille haute...,12.6,True,6,4
Must Have - Pantalon taille...,13.44,True,4,5
Chemisier asymétrique sexy...,28.56,True,3,5
Pantalon taille haute...,23.52,True,4,2
Ensemble 2 pièces en...,23.52,True,1,1
"Ensemble 2 pièces ""LOVE""",23.52,True,1,4
Ensemble 2 pièces tendance,31.92,True,5,1
Ensemble 2 pièces Fashionista,42.0,True,5,3
Pull court tendance à nouer,15.96,True,3,1
Robe en maille tendance,24.36,True,4,1
Trench tendance avec ceinture,42.0,True,4,1
Manteau pied-de-poule tendance,48.72,True,4,1
Pantalon taille haute tendance,23.52,True,6,1
Jeans skinny tendance...,21.84,True,5,1
Jeans skinny taille haute...,21.84,True,6,1
Pantalon évasé taille avec...,11.76,True,5,1
Chemise fashion,21.84,True,6,1
Pantalon simili cuir 'Thong...,28.56,True,6,1
Chemisier aspect satiné,20.16,True,4,1
Pantalon taille haute...,12.6,True,6,1
Crop top bandeau tendance...,23.52,True,3,1
Chemisier court tendance...,23.52,True,5,1
Crop top cache-cœur tendance,18.48,True,7,1
Ensemble assorti 2 pièces...,30.24,True,4,3
Jupe mi-longue tendance en...,23.52,True,4,1
Pull court confortable,21.84,True,4,1
Robe en maille tendance,23.52,True,4,1
Cardigan tendance en grosse...,25.2,True,5,4
Pull tendance en maille...,19.32,True,3,4
Jupe en maille taille haute,18.48,True,2,2
