Articles,Prices,InStocks,N_colors,N_sizes
"Sweat shirt tendance ""cash...",11.4,True,5,1
Pull en maille Koucla tendance,9.0,True,5,3
Mini robe sexy avec basque...,18.0,True,4,1
Top sexy cache coeur avec...,12.0,True,5,1
Robe bandeau sexy à paillettes,6.0,False,4,1
Mini robe sexy transparente,21.84,True,3,4
Robe longue sexy avec des...,40.32,True,3,3
Robe sexy Koucla,31.92,True,2,1
Mini-soirée sexy Koucla...,25.2,True,3,3
Combi short sportswear...,15.96,False,1,1
Pull large tendance,15.12,True,5,3
Robe de gala sexy avec strass,7.8,True,5,4
Robe de soirée sexy avec...,25.2,True,3,4
Blazer KouCla sexy,15.12,True,4,1
Mini robe sexy avec de la...,15.6,True,10,1
Mini robe gogo sexy avec...,14.4,True,6,5
Treggings sexy avec zips,18.0,True,4,2
Mini-robe bandeau sexy avec...,8.4,True,3,2
Mini-robe avec un décolleté...,21.84,True,4,3
Mini robe sexy avec tissu...,8.4,True,3,1
Mini robe sexy avec de la...,18.48,True,5,2
Leggings sexy avec laçage...,16.8,True,3,3
Robe fourreau sexy avec de...,8.4,True,4,4
Salopette débardeur sexy bi...,19.2,True,6,2
Robe bustier à bretelles...,25.2,True,4,1
Leggings sportswear...,20.16,True,3,5
Treggings sexy simili cuir,25.2,True,1,1
Robe de soirée sexy look...,7.8,True,5,1
Pull sexy avec laçage et...,21.84,True,5,1
Mini-robe sexy en maille...,16.8,True,6,3
Mini robe sexy aspect...,20.16,True,1,1
Robe sexy look portefeuille,20.16,True,4,4
Salopette de soirée sexy...,30.24,True,3,4
Jeans skinny sexy,19.8,True,1,1
Pull sexy,13.8,True,6,5
Veste sexy look militaire,28.56,True,1,1
Robe longue sexy dos nu...,30.24,True,4,2
Pantalon sexy simili cuir,7.2,True,5,4
Pantalon sexy à carreaux...,15.6,True,2,3
Leggings sexy en dentelle,6.0,True,2,3
Robe sexy  avec dentelle et...,21.0,True,1,1
Mini robe sexy gogo,21.0,True,3,3
Treggings sportswear tendance,12.0,True,4,1
Robe en maille à col roulé...,20.16,True,5,4
Blazer sexy ajusté en...,25.2,True,2,1
Robe de soirée sexy  avec...,26.88,True,4,3
Robe longue sexy avec...,23.4,True,5,4
Robe de soirée sexy Koucla...,40.32,True,3,1
Mini-robe sexy KouCla bi...,15.6,True,5,3
Mini robe sexy,23.52,True,3,4
Pantalon sexy en similicuir,25.2,True,3,4
Treggings  sexy avec...,14.4,True,2,4
Pantalon sexy Skinny effet...,21.0,True,1,4
Pantalon sexy imprimé carré,18.0,True,1,1
Mini robe sexy asymétrique...,21.84,True,3,1
Mini robe sexy chauve...,20.16,True,5,1
Robe avec décolleté sexy,23.52,True,4,2
Mini robe débardeur sexy,5.1,True,7,1
Robe sexy avec laçage,21.84,True,4,2
Leggings sexy avec...,11.76,True,2,1
Jupe crayon sexy,13.2,True,7,1
Cardigan en maille tendance,21.84,True,4,1
Pull tendance Koucla 2 en 1,11.4,True,5,4
Robe fourreau sexy avec...,20.16,True,3,3
Mini robe sexy dos nu avec...,23.52,True,1,2
Leggings sexy avec...,10.92,True,3,1
Combishort sexy à bretelles...,17.64,True,2,1
Robe de soirée sexy bi couleur,7.8,True,5,4
Robe de soirée sexy,35.28,True,3,4
Salopette de soirée sexy...,30.24,True,3,4
Combinaison sexy effet...,23.52,True,1,3
Combinaison sexy,28.97,False,2,3
Robe bandeau sexy,15.6,True,4,1
Robe Koulcla sexy avec strass,18.48,True,4,1
Robe sexy Koucla en maille...,17.4,True,4,1
Mini robe sexy avec des...,20.16,True,3,1
Robe longue sexy dos nu...,30.24,True,3,4
Jupe crayon sexy avec...,14.4,True,1,4
Robe sexy en dentelle...,31.92,True,3,4
Robe sexy Koucla avec zip,25.2,True,5,4
Robe longue sexy KouCla...,35.28,True,3,1
Robe pull tendance en...,15.6,True,7,3
Robe de soirée sexy à...,21.84,True,4,1
Mini robe débardeur sexy 2...,9.0,True,7,4
Treggings taille haute sexy...,28.56,True,1,1
Mini robe sexy froncée avec...,20.16,True,3,4
Combinaison tendance dos sexy,26.88,True,2,1
Pantalon sexy KouCla,7.2,True,5,3
Top sexy,3.9,True,8,4
Robe longue Sexy...,26.88,True,2,2
Pantalon sexy en simili...,26.88,True,4,1
Leggings sexy effet mouillé...,8.4,True,2,1
"Robe sexy, longue avec...",30.24,True,4,4
Leggings tendance,9.24,True,3,3
Salopette sexy à épaules...,26.88,True,3,5
Mini robe sexy pailletée...,28.56,True,4,5
Pantalon taille haute sexy,19.2,True,1,3
Jupe sexy en simili cuir...,20.16,True,1,5
Mini jupe sexy effet...,16.8,True,4,4
Jeans sexy avec de la dentelle,20.4,True,1,4
Mini-robe d'affaires sexy...,9.0,True,2,1
Mini robe sexy avec...,7.2,True,4,1
Combinaison sexy KOUCLA...,25.2,True,2,6
Pull sexy en maille,18.48,True,6,1
Jeans sexy réversible 2 en...,31.92,True,1,3
Mini robe sexy KouCla effet...,20.16,True,2,2
Combinaison sexy KouCla...,28.56,True,3,4
Combinaison sexy KouCla...,23.52,True,3,2
Pantalon sexy en simili...,33.6,True,1,2
Leggings  sexy effet mouillé,10.92,True,3,2
Leggings sexy simili cuir...,15.12,True,3,3
Minirobe sexy KouCla avec...,8.4,True,4,1
Mini robe sexy asymétrique...,7.8,True,5,1
Minirobe sexy avec filet,20.16,True,2,2
Pull sexy à col bardot,13.8,True,5,1
Leggins sexy clouté,5.7,True,5,4
Mini robe de soirée sexy,7.8,True,3,3
Blazer business sexy,15.84,True,2,1
Short sexy,5.7,True,3,4
Robe débardeur tendance,23.52,True,4,4
Pantalon sexy aspect cuir...,30.24,True,1,1
Leggings skinny sexy look...,10.92,True,1,4
Pull court Koucla en maille...,13.44,True,5,4
Robe longue de soirée sexy...,38.64,True,3,5
Robe droite sexy à manches...,25.2,True,3,2
Combinaison bandeau sexy en...,43.68,True,1,1
Leggings sexy imprimé Léopard,10.2,True,4,1
Mini-robe sexy XMAS à capuche,23.52,True,1,1
Mini robe décolleté sexy,21.84,True,2,1
Robe sexy en maille,23.52,True,1,2
Leggings sexy effet mouillé...,20.16,True,2,2
Leggings sexy avec insert...,7.8,True,1,2
Leggings sexy clouté,9.6,True,3,2
Leggings sexy brillant avec...,14.28,True,2,2
Leggings sexy avec...,9.24,True,2,2
Leggings sexy avec...,10.92,True,3,1
Leggings sexy effet mouillé,9.24,False,4,3
Leggings tendance avec...,7.56,True,2,1
Leggings sexy avec laçage,11.76,True,3,2
Leggings sexy destroy,7.56,False,3,2
Leggings taille haute sexy,15.12,True,1,2
Leggings sexy simili cuir...,11.76,True,2,1
Leggings taille haute sexy...,15.12,True,3,1
Leggings sexy motif léopard,6.6,True,2,4
Robe asymétrique sexy avec...,27.26,True,5,1
Combishort sexy effet Jeans,25.2,True,1,1
Ensemble tendance sportswear,21.84,True,6,1
Crop top sexy,6.72,True,6,3
Ensemble short et top...,23.52,True,7,4
Jupe simili cuir sexy,15.12,True,3,4
Blouse transparente à...,14.28,True,4,4
Mini-jupe sexy aspect cuir...,21.0,True,2,4
Mini-jupe sexy à carreaux,18.48,True,1,5
Mini-jupe sexy en velours...,20.16,True,3,4
Mini-jupe sexy en denim à...,21.84,True,2,5
Jupe crayon sexy à carreaux...,14.4,True,1,4
Mini-jupe sexy en jeans à...,21.84,True,3,1
Mini-jupe sexy imprimé...,18.48,True,1,4
Short sexy avec jupe longue...,21.84,True,2,4
Mini jupe sexy avec laçage,18.48,True,1,1
Short sexy,10.08,True,2,5
Pull et short à col roulé...,26.88,True,5,2
Treggings sexy KouCla avec...,18.0,True,5,2
Jeggings sexy avec poches,9.24,True,2,4
Pantalon Sexy KouCla Skinny...,20.16,True,3,3
Pantalon sexy effet mouillé...,15.6,True,1,1
Combishort sexy,16.8,True,2,2
Combishort sexy avec dentelle,23.52,True,2,4
Combi short tendance,10.08,False,3,5
Short sexy effet mouillé...,12.6,True,2,5
Pantalon sexy simili cuir...,25.2,True,1,4
Pantalon sexy KouCla en...,18.0,True,3,4
Pantalon sexy en similicuir...,26.88,True,3,4
Pantalon sexy en similicuir,25.2,True,2,4
Pantalon Sexy en similicuir...,31.92,True,1,5
Leggings sexy en similicuir...,25.2,True,1,5
Pantalon en similicuir...,28.56,True,1,5
Pantalon aspect cuir sexy...,20.4,True,1,3
Pantalon sexy Koucla aspect...,20.4,True,1,1
Pantalon en tissu tendance...,8.4,True,4,4
Pantalon sexy scintillant,21.84,True,3,4
Pantalon sexy en cuir...,25.2,True,1,4
Pantalon en cuir sexy à...,26.88,True,4,4
Treggings sexy en...,23.52,True,3,4
Jeans slim tendance,19.8,True,1,4
Pantalon sexy en similicuir,26.88,True,2,1
Combinaison sexy,26.88,True,3,4
Leggings sexy KouCla avec...,9.24,True,3,3
Pantalon sexy Latex avec...,25.2,True,2,4
Short sexy taille haute...,10.92,True,2,5
Leggings effet mouillé...,16.8,True,2,4
Pantalon sexy en similicuir...,28.56,True,1,4
Pantalon taille haute sexy...,28.56,True,1,4
Pantalon sexy en similicuir...,28.56,True,2,1
Pantalon sexy en similicuir...,30.24,True,1,1
Combinaison sexy effet...,30.24,True,4,1
Mini robe sexy avec chaîne...,21.84,True,3,1
Mini robe sexy effet mouillé,18.48,True,2,4
Crop top sexy effet cuir,10.92,True,1,3
Salopette sexy avec ceinture,30.24,True,2,3
Combinaison sexy à bretelles,26.88,True,3,3
Combinaison sexy avec...,30.24,True,3,3
Combinaison Koucla sexy,28.56,True,3,1
Combinaison sexy avec des...,25.2,True,2,3
Combinaison sexy,30.24,True,3,4
Combinaison sportswear...,26.88,True,4,4
Combinaison élégante KouCla...,26.88,True,1,3
Salopette sexy avec de la...,30.24,True,3,4
Combinaison sexy...,19.2,True,2,4
Salopette business sexy,26.04,True,1,6
Combinaison sexy avec...,28.56,True,3,1
Sweat sexy look militaire,9.0,True,1,1
Pull tendance KouCla en...,15.6,True,4,1
Robe Pull Sexy,15.96,True,5,2
Pull sexy en maille KouCla...,15.6,True,7,4
Top tendance à épaules...,15.96,True,2,1
Jupe taille haute en...,23.52,True,2,1
Crop top sexy,13.2,True,6,1
Ensemble sportswear tendance,21.84,True,5,1
Ensemble sportswear destroy...,31.2,True,4,3
Ensemble top et bermuda à...,28.8,True,4,1
Bikini sexy,18.48,True,7,4
Cardigan sexy à manches...,14.28,True,8,1
Mini robe sexy effet mouillé,18.48,True,3,3
Robe sexy asymétrique,24.0,True,6,4
Mini jupe sexy aspect cuir,15.12,True,3,1
Mini jupe sexy effet mouillé,14.28,True,3,3
Salopette col V sexy à nouer,36.0,True,6,1
Crop top sexy effet mouillé,15.12,True,3,1
Cardigan Sexy en  dentelle,25.2,True,3,1
Robe de soirée sexy simili...,16.8,True,3,1
Mini robe sexy avec des...,16.8,True,2,1
Sweat sexy à manches...,12.6,True,2,3
Robe longue dos nu sexy...,19.2,True,2,1
Robe fourreau sexy col au...,21.84,True,2,1
Robe de soirée sexy bandeau...,20.16,True,4,2
Mini robe de soirée sexy,25.2,True,4,3
Mini robe sexy avec...,23.52,True,2,1
Mini robe sexy avec dentelle,21.84,True,3,1
Mini robe sexy Go-Go avec...,16.8,True,3,1
T shirt sexy rayé,13.44,True,2,4
Mini robe sexy go go simili...,23.52,True,2,3
Pantalon skinny tendnce...,19.8,True,1,1
Mini-robe sexy en...,28.56,True,3,1
Robe droite sexy avec de la...,8.4,True,5,4
Mini robe sexy avec laçage,21.84,True,3,1
Robe longue de soirée sexy,38.64,True,3,4
Mini-robe sexy avec des...,21.84,True,3,5
Robe longue de soirée sexy,40.32,True,3,1
Jeans sexy entrejambe boutonné,25.2,True,1,1
Robe longue de soirée sexy...,21.6,True,2,3
Mini-robe sexy avec basque,21.84,True,2,1
Mini robe sexy avec...,7.8,True,3,3
Mini robe sexy dos nu,21.84,True,4,1
Mini robe bandeau sexy avec...,20.16,True,1,4
Mini robe sexy avec basque,21.84,True,3,1
Robe longue sexy avec broderie,31.92,True,3,1
Pull court sexy à col roulé,11.76,True,6,4
Robe courte sexy à paillettes,21.84,True,3,3
Robe de gala sexy avec des...,40.32,True,3,3
Robe de soirée sexy,20.16,True,3,4
Salopette sexy avec...,31.92,True,2,1
Salopette sexy avec de la...,30.24,True,3,3
Salopette sexy avec...,23.52,True,5,3
Robe droite sexy à manches 3/4,21.84,True,2,1
Mini robe sexy GoGo avec...,25.2,True,2,2
Robe longue sexy avec des...,30.24,True,4,4
T-shirt tendance à épaules...,16.8,True,2,1
Mini robe sexy en cuir à...,26.88,True,3,1
Mini robe simili cuir sexy,20.16,True,4,2
Pull col bardot tendance,10.8,True,5,1
Leggings destroy sexy,8.4,True,1,1
Mini-robe bandeau sexy...,18.48,True,1,4
Mini robe sexy avec des strass,20.16,True,4,2
Robe longue de soirée sexy,40.32,True,3,4
Robe sexy avec de la dentelle,21.84,True,4,1
Robe longue sexy avec des...,40.32,True,3,3
Mini-robe sexy à col roulé...,18.48,True,5,3
Robe fourreau sexy  aspect...,16.8,True,2,3
Mini robe sexy,21.84,True,2,3
Robe d'affaires sexy avec...,28.56,True,1,1
Salopette sexy avec de la...,31.92,True,3,6
Mini robe sexy à col bardot...,7.2,True,4,1
Robe d'été tendance,25.2,True,2,3
Mini robe sexy avec des...,21.84,True,2,1
Robe sexy avec des...,23.52,True,2,1
Crop top sexy à manches...,13.44,True,5,1
Mini-robe bandeau sexy à...,7.8,True,5,3
Crop top sexy à col bardot,16.8,True,5,4
Robe sexy avec décolleté...,21.84,True,3,4
Robe longue de soirée sexy...,38.64,True,3,1
Robe longue de soirée sexy,40.32,True,3,1
Robe droite étui tendance,23.52,True,4,4
Robe en maille à col roulé...,22.68,True,6,4
Blazer sexy,24.0,True,4,4
Mini robe sexy effet cuir,22.68,True,4,1
Robe de soirée sexy,40.32,True,3,4
Mini robe sexy à nouer,20.16,True,4,3
Robe longue sexy,40.32,True,3,3
Salopette sexy avec des...,30.24,True,3,1
Robe fourreau sexy avec de...,25.2,True,3,1
Robe sexy en maille à col...,20.16,True,4,1
Mini robe bandeau sexy avec...,8.4,True,5,4
Mini robe sexy avec laçage,21.84,True,2,1
Blazer sexy avec bouton,15.12,True,4,1
Mini-robe sexy en maille à...,20.16,True,5,4
Robe portefeuille sexy en...,25.2,True,7,3
Robe longue sexy à bretelles,40.32,True,3,5
Robe de soirée sexy avec de...,31.92,True,2,4
Jeans sexy camouflage,25.2,True,2,1
Short sexy effet cuir,10.08,True,2,5
Robe longue sexy avec des...,30.24,True,3,4
Pantalon sexy camouflage,21.6,True,1,1
Blazer business sexy,30.24,True,1,1
Mini robe sexy à épaules...,20.16,True,3,1
Robe mi longue sexy en maille,23.52,True,6,4
Mini robe sexy avec de la...,21.84,True,2,5
Robe longue sexy avec des...,30.24,True,3,4
Jeans tendance avec broderie,28.56,True,1,1
Robe de soirée sexy avec...,40.32,True,3,1
Pull en maille tendance,11.4,True,4,1
Mini robe bandeau sexy avec...,7.8,True,1,1
Robe étui sexy avec maille...,21.84,True,6,4
Mini robe sexy effet cuir,15.96,True,3,1
Blazer sexy,25.2,True,1,1
Robe longue de soirée sexy...,25.2,True,2,1
Body sexy KouCla,18.48,True,4,1
Mini robe sexy KouCla,21.84,True,1,2
Pull tendance en tricot KouCla,20.16,True,5,1
Pull court à col roulé sexy,14.28,True,7,1
Pull sexy dos nu,15.96,True,6,1
Robe moulante sexy en...,16.8,True,6,1
Robe tricotée sexy à col...,16.8,True,6,1
Pull sexy col V,18.48,True,6,1
Pull à col roulé sexy dos...,30.0,True,7,1
"Pull côtelé sexy, laçage au...",26.4,True,6,1
Robe courte sexy en maille,16.8,True,12,1
"Robe sexy en maille, col V,...",16.8,True,6,1
Pull sexy court en maille fine,14.28,True,8,1
Robe trapèze sexy en maille...,16.8,True,6,1
Pull sexy col en V avec...,18.48,True,5,1
Pull court sexy à col roulé...,15.96,True,6,1
Robe sexy en maille fine...,15.96,True,6,1
Pull court sexy,14.28,True,6,4
Robe sexy tendance col montant,28.56,True,3,1
Pantalon sexy taille haute...,23.52,True,2,2
Robe sexy en tricot avec...,26.88,True,1,1
Combinaison tendance 2...,21.84,True,6,1
Body tendance asymétrique,15.96,True,5,3
Robe Koucla moulante à...,16.8,True,5,4
Pantalon tendance taille haute,25.2,True,3,3
Jupe sexy à volants en faux...,15.96,True,4,1
Jupe sexy ouverte devant,16.8,True,3,3
Top sexy en satin dos nu,16.8,True,5,1
Crop top sexy Koucla à...,13.44,True,5,4
Débardeur tendance en tricot,11.4,True,6,4
Jupe sexy KOUCLA aspect cuir,16.8,True,1,1
Manteau long Koucla...,45.36,True,3,3
Pull sexy asymétrique,16.8,True,9,5
Short sexy en simili cuir...,21.84,True,3,3
Jeans skinny sexy LOVE YOUR...,23.52,True,2,1
Legging sexy taille haute...,10.92,True,7,1
Mini robe sexy,20.16,True,3,1
Pull tendance à capuche,26.4,True,7,1
Pull à col roulé tendance...,26.4,True,8,3
Mini robe sexy clubwear Party,21.84,True,5,2
Robe longue sexy en simili...,26.88,True,4,1
Pantalon sexy taille haute...,16.8,True,3,2
Pull en tricot oversize...,16.8,True,6,3
Pull Carmen sexy avec strass,10.8,True,5,4
Haut sexy en cuir à manches...,20.16,True,4,1
Haut sexy à manches longues...,15.12,True,5,2
Robe courte sexy à paillettes,20.16,True,5,3
Pull sexy à col en U avec...,10.8,True,5,1
Mini jupe sexy taille haute...,21.84,True,8,1
Haut sexy en filet Koucla...,12.6,True,3,4
Ensemble tendance,33.6,True,5,2
Jupe tendance taille haute...,15.96,True,2,2
Sweat-shirt court sexy LOVE,12.0,True,5,1
Sweat-shirts tendance...,12.0,True,6,1
Mini jupe sexy avec bande...,11.76,True,5,5
Jupe sexy avec des franges...,15.12,True,3,4
Veste courte sexy avec...,28.8,True,3,1
Veste Teddy confortable et...,57.6,True,5,1
Sweat à capuche tendance en...,20.16,True,7,1
Pull sexy en maille à une...,20.16,True,7,3
Body sexy dos nu plongeant...,21.84,True,3,4
Leggins sexy aspect cuir...,14.28,True,1,1
Veste d'affaires ajustée sexy,43.2,True,2,4
Pantalon Sexy,20.16,True,2,4
Combinaison fashion à...,30.24,True,1,4
Jupe crayon fashion en...,15.12,True,3,1
Combinaison fashion,23.52,True,2,1
Pull long fashion en grosse...,18.48,True,6,1
Pull fashion en maille torsadé,17.64,True,3,2
Pull tendance à épaules...,16.8,True,6,1
Leggings tendance taille...,9.24,True,6,5
Robe ajustée tendance avec...,31.2,True,8,5
Veste fashion brillante...,40.32,True,2,1
Veste d'hiver tendance avec...,36.96,True,2,1
Pull oversize en maille...,21.84,True,6,1
Pull sexy en maille à...,16.8,True,6,1
Pull court fashion avec...,16.8,True,6,1
Manteau en peluche tendance...,49.56,True,3,5
Crop-top latina fashion,13.44,True,7,5
Jeans déchiré tendance look...,25.2,True,1,5
Jeans déchiré tendance...,23.52,True,1,5
Jeans déchiré tendance look...,25.2,True,4,1
Jeans déchiré tendance,25.2,True,2,1
Body fashion,23.52,True,6,5
Robe sexy en maille côtelée...,23.52,True,5,1
Jeans fashion super slim,23.52,True,2,1
Robe midi tendance en maille,26.04,True,6,1
Pull côtelé tendance à une...,17.64,True,6,3
Robe fashion en maille...,23.52,True,5,4
Mini robe sexy,25.2,True,2,5
Mini robe sexy en latex...,30.24,True,2,1
Jeans tendance,23.52,True,2,3
Haut court fashion...,16.8,True,7,1
Crop top tendance fashion,10.92,True,3,1
Robe tendance en maille...,23.52,True,6,1
Robe moulante fashion à une...,21.84,True,6,1
Robe fashion en tricot dos...,25.2,True,5,1
Robe fashion en tricot avec...,25.2,True,6,1
Robe tendance en tricot à...,22.68,True,5,1
Robe courte fashion à volants,18.48,True,4,1
Robe fashion avec laçage,21.0,True,4,3
Robe fashion en velours...,21.84,True,6,1
Mini robe sexy,21.84,True,2,3
Combinaison fashion effet...,25.2,True,5,4
Robe avec pierres...,47.04,True,2,3
Robe déesse fashion à une...,57.6,True,1,4
Robe de soirée tendance col...,26.88,True,1,3
Robe de soirée tendance...,35.28,True,1,1
Crop top fashion en satin...,15.12,True,3,3
Crop top tendance aspect...,16.8,True,6,4
Mini robe fashion à col en...,25.2,True,5,1
Mini robe tendance à...,23.52,True,6,4
Mini robe asymétrique tendance,23.52,True,5,1
Mini robe fashion à effet...,25.2,True,6,1
Robe fashion en maille à...,21.84,True,9,3
Crop top fashion Koucla en...,15.96,True,7,4
Short tendance fashion,10.8,True,1,1
Jupe crayon sexy avec...,18.48,True,3,1
Robe fashion en maille fine...,16.8,True,7,5
Mini robe tricotée fashion...,16.8,True,3,5
Jeans skinny fashion look usé,20.16,True,1,1
Short fashion avec dentelle,15.12,True,1,1
Robe tricotée fashion...,16.8,True,7,1
Robe midi fashion en maille...,16.8,True,5,4
Crop Top fashion Koucla...,14.28,True,3,3
Crop top en latex,15.12,True,2,4
Crop top à une épaule Koucla,7.56,True,3,1
Salopette tendance Koucla à...,25.2,True,7,3
Mini robe fashion avec...,16.8,True,4,1
Mini robe fashion look satin,18.48,True,5,3
Mini robe fashion KouCla,18.48,True,4,2
Ensemble fashion,18.48,True,1,1
Ensemble fashion avec...,18.48,True,1,1
Ensemble fashion avec...,18.48,True,4,3
Pull en V tendance,16.8,True,7,4
Body Koucla look latex,21.84,True,2,4
Bustier tendance KouCla,12.6,True,6,4
Salopette fashion en simili...,31.92,True,2,4
Combinaison fashion,30.24,True,1,4
Jupe asymétrique fashion en...,16.8,True,2,3
Jupe fashion aspect cuir à...,16.8,True,2,4
Jupe crayon tendance avec ZiPP,16.8,True,2,3
Robe asymétrique fashion en...,23.52,True,10,3
Robe fashion en satin à col...,23.52,True,4,3
Mini robe asymétrique...,23.52,True,5,1
Robe fashion en satin à...,23.52,True,4,1
Mini robe fashion en satin...,23.52,True,5,1
Pull fashion avec laçage au...,16.8,True,6,2
Top court sexy à manches...,11.4,True,6,1
Pantalon à carreaux fashion...,9.24,True,3,1
Pantalon de survêtement...,22.68,True,7,5
Pantalon taille haute...,15.12,True,4,3
Jeans fashion taille haute,21.84,True,1,1
Blouse courte fashion à...,21.84,True,1,4
Pull fashion super court à...,13.2,True,7,4
Pantalon fashion en latex,21.0,True,5,1
Pantalon fashion avec ceinture,20.16,True,4,1
Veste en simili cuir très...,20.4,True,6,1
Robe nuisette fashionà...,21.84,True,6,1
Mini robe fashion à volants...,21.84,True,5,1
"Ensemble fashion, pantalon...",36.96,True,2,1
Top fashion,10.08,True,3,5
Blazer fashion à double...,31.92,True,5,5
Jeans skinny tendance...,23.52,True,4,5
Jeans fashion taille haute...,21.84,True,3,1
Jeans tendance taille haute...,21.84,True,1,1
Crop top tendance avec...,13.44,True,6,1
Haut fashion à une épaule à...,11.4,True,6,1
Crop top fashion avec...,12.6,True,6,1
Top fashion 2en1 à bretelles,16.8,True,6,1
Mini robe sexy à col en V...,33.6,True,7,1
Haut à volants transparent...,10.92,True,4,1
Robe fashion à volants à...,21.84,True,8,1
Top tendance basique à...,11.76,True,7,1
Robe moulante fashion à...,20.16,True,5,1
Combinaison sweat tendance...,26.4,True,5,4
Top à manches longues...,10.2,True,6,3
Crop top effet mouillé fashion,7.56,True,3,3
Robe moulante fashion à une...,28.56,True,8,2
Robe patineuse fashion dos...,21.84,True,2,2
Pantalon taille haute sexy...,10.92,True,6,2
Haut fashion à manches...,12.6,True,2,2
Top fashion avec aspect...,10.92,True,3,4
Ensemble sportif tendance...,28.8,True,5,4
Combinaison fashion KouCla...,21.84,True,2,1
Jupe midi tendance en...,16.8,True,2,2
Robe asymétrique fashion à...,21.84,True,1,2
Mini-robe de soirée...,33.6,True,3,3
Leggings sexy effet mouillé...,13.44,True,1,2
Leggings sexy taille haute...,8.4,True,5,4
Body sexy en dentelle à...,15.12,True,6,2
Combinaison tendance avec...,16.8,True,5,2
Ensemble sportif sexy short...,24.0,True,6,1
Ensemble fashion 'BE...,28.8,True,6,4
Mini robe fashion,20.16,True,1,1
Combinaison fashion avec...,21.84,True,4,1
Top fashion à volants avec...,15.12,True,6,1
Top brodé décolleté avec...,14.28,True,6,1
Haut sexy dos nu à lacets,14.28,True,8,1
Haut cache-cœur sexy aspect...,8.4,True,1,6
Robe moulante sexy basique...,16.8,True,5,5
Short en jeans sexy,20.16,True,3,5
Jeans sexy déchiré taille...,23.52,True,1,5
Jeans skinny déchiré sexy...,22.68,True,1,5
Jeans sexy skinny déchiré,21.84,True,3,1
Jupe en jeans boutonnée...,21.84,True,2,1
Blouse courte fashion avec...,16.8,True,2,1
Haut sexy à col bénitier en...,10.92,True,8,5
Salopette sexy à manches...,23.52,True,10,5
Jeans skinny sexy aspect...,22.68,True,1,5
Jeans Sexy Mom Fit Usé,24.36,True,1,5
Jeans skinny sexy avec...,22.68,True,2,5
Jeans skinny gris déchiré,22.68,True,1,5
Jeans skinny sexy à jambe...,22.68,True,1,1
Mini jupe sexy en denim...,21.84,True,1,1
Haut tendance à lier,10.08,True,6,1
Haut tendance à bretelles...,12.6,True,3,1
Haut fashion bandeau court...,5.04,True,9,1
Top fashion,9.24,True,6,1
Haut tendance court Carmen...,20.4,True,4,1
Combinaison fashion à jambe...,31.92,True,5,1
Combinaison tendance...,21.84,True,2,1
Short en jean sexy avec...,18.48,True,4,1
Short sexy à fleurs à volants,19.2,True,4,1
Mini robe moulante fashion...,21.84,True,6,1
Robe moulante fashion...,31.2,True,6,1
Haut court fashion torsadé,16.8,True,3,1
Combinaison tendance,28.56,True,5,2
Combinaison dos nu fashion,23.52,True,5,1
Short d'été élégant fashion...,10.08,True,5,1
Robe fashion en fausse soie...,16.8,True,4,1
Ensemble fashion pantalon...,31.92,True,2,1
Combinaison fashion avec...,32.4,True,4,1
Top court fashion avec...,9.0,True,5,1
Top fashion dos nu,12.6,True,5,1
Pantalon fashion à jambes...,16.8,True,5,1
Short en jean fashion LOVE...,17.64,True,2,1
Combi élégante fashion avec...,21.84,True,4,1
Combi fashion à épaules...,17.64,True,6,1
Ensemble fashion - Pantalon...,28.56,True,7,6
"Ensemble fashion, jupe +...",26.88,True,5,4
Paréo fashion,15.96,True,8,5
Jeans fashion taille haute...,28.56,True,1,5
Jeans fashion taille haute,26.88,True,1,5
Jeans skinny déchiré fashion,20.16,True,1,5
Jeans fashion taille haute...,30.24,True,1,1
Jeans fashion taille haute,25.2,True,1,1
Jeans fashion taille haute,28.56,True,1,1
Robe fashion avec rayures...,26.4,True,5,2
Short legging tendance,5.88,True,6,1
Paréo fashion avec cordon...,15.12,True,2,1
Combinaison portefeuille...,21.6,True,6,1
Top fashion dos nu en satin...,14.28,True,7,3
Haut court fashion à...,20.4,True,4,1
Crop top fashion avec...,15.12,True,6,3
Blazer classique fashion...,33.6,True,5,1
Bandana-Top fashion avec...,5.88,True,5,2
Pantalon classique tendance...,21.84,True,5,2
Robe fashion avec décolleté...,31.92,True,5,1
Short sportif tendance avec...,7.56,True,4,2
Combinaison à fleurs...,19.2,True,4,2
Combinaison d'été fashion...,19.32,True,5,2
Ensemble sportif tendance -...,18.48,True,3,1
Combinaison d'été fashion à...,18.0,True,3,2
Maxi robe d'été fashion...,24.0,True,8,1
Ensemble fashion pantalon...,26.88,True,7,1
Short fashion à pois avec...,10.08,True,4,1
Body fashion avec bretelles,19.2,True,5,1
Robe fashion à épaules...,24.0,True,6,1
Mini jupe à fleurs,21.6,True,4,2
Robe d'été basique sexy à...,21.6,True,5,2
Short fashion en jeans...,18.48,True,5,3
Robe nuisette fashion à...,20.4,True,6,1
Short fashion avec poches,8.4,True,6,1
Leggings push-up fashion...,13.44,True,3,2
Jupe latina fashion,16.8,True,7,1
Mini-jupe fashion en satin...,21.6,True,5,1
Ensemble de sport - Crop...,33.6,True,4,1
"Ensemble de sport, haut...",14.28,True,6,1
Body tendance avec découpes,20.4,True,5,1
Chemisier court tendance à...,18.48,True,6,1
Robe longue tendance en...,30.24,True,7,1
Robe tendance à longues...,27.6,True,6,1
Combi-short tendance,31.92,True,2,1
Combinaison tendance à...,39.6,True,4,2
Robe longue tendance dos nu...,23.52,True,2,1
Combinaison d'été tendance...,31.2,True,4,5
Ensemble de sport tendance...,28.8,True,1,3
Pantalon taille haute...,16.8,True,4,2
Short en jeans taille haute...,16.8,True,1,1
Jeans skinny tendance,21.84,True,4,1
Jeans taille basse tendance...,21.84,True,1,1
Short tendance avec ceinture,13.2,True,3,1
Jupe tendance,11.76,True,4,1
