Articles,Prices,InStocks,N_colors,N_sizes
Pantalon sexy en similicuir...,18.0,True,2,5
Treggings sexy KouCla avec...,13.44,True,4,5
Pantalon sexy en similicuir...,18.0,True,2,1
Body sexy en tissu résille...,12.0,True,4,2
Mini robe sexy KouCla avec...,7.8,True,8,1
Pull sexy Koucla 2 en1,12.38,True,7,1
Pull Koucla sexy,9.36,True,5,1
Pull Koucla tendance...,9.36,True,6,1
Pull chauve-souris tendance...,9.0,True,5,1
Pullover Koucla tendance...,9.36,True,6,3
Bikini triangle sexy avec...,9.12,True,6,5
Pantalon skinny KouCla sexy...,18.0,True,1,4
Treggings sexy avec clous...,16.32,True,3,3
Treggings sexy en...,14.4,True,6,2
Pantalon détente tendance...,15.74,True,3,3
Treggings sexy KouCla en...,20.4,True,1,3
Treggings sexy avec...,15.6,True,1,3
Jupe crayon sexy KouCla...,15.0,True,2,2
Robe en mousseline de soie...,6.6,True,3,3
Bustier sexy KouCla avec...,13.44,True,4,2
Crop top manches longues...,12.96,True,4,5
Jeans skinny sexy destroy...,20.81,True,1,3
Mini robe sexy avec Aspect...,18.0,True,3,3
Pantalon skinny sexy en...,18.0,True,2,4
Corsage sexy avec strass,9.6,True,7,3
Bikini triangle sexy avec...,9.6,True,5,4
Monokini sexy,10.08,True,8,3
Bikini sexy avec Zip,10.56,True,4,3
Bikini sexy avec strass,10.56,True,4,3
Bikini sexy,10.56,True,3,3
Bikini sexy avec boucle...,10.56,True,5,3
Bikini triangle sexy avec...,9.6,True,4,3
Bikini sexy imprimé animal,10.56,True,4,4
Bikini tendance avec...,10.56,True,4,3
Monokini sexy asymétrique...,10.56,True,4,3
Bikini triangle sexy avec...,10.56,True,4,3
Body sexy KouCla avec dentelle,10.8,True,6,4
Body sexy avec maille fine,10.2,True,6,4
Robe de soirée sexy KouCla,26.04,True,5,4
Pantalon sexy en similicuir...,9.0,True,3,1
Jambières en tricot sexy,9.24,True,7,1
Jambières sexy motif losanges,5.28,True,5,2
Collants sexy en maille,5.04,True,2,1
Robe gogo sexy avec...,15.6,True,6,1
Cardigan KouCla sexy avec...,12.0,True,5,2
T-shirt tendance rayé,9.0,True,8,1
Sweat à capuche tendance...,16.8,True,7,1
Pull KouCla sexy avec...,14.4,True,6,2
T-shirt sexy avec strass...,10.2,False,11,2
T-shirt sexy KouCla avec...,4.5,False,7,2
T-shirt KouCla sexy avec...,4.2,False,11,1
Pull Koucla tendance...,12.0,True,6,2
T-shirt sexy 'I Love...,3.9,False,9,2
T-shirt sexy KouCla avec...,5.04,False,11,2
T-shirt tendance KouCla...,3.9,True,11,2
T-shirt sexy KouCla avec...,9.0,False,11,2
T-shirt sexy KouCla avec...,9.6,True,11,2
T-shirt sexy KouCla avec...,4.2,True,8,1
Minirobe sexy froncée avec...,18.14,True,9,1
Pull à épaules dénudées en...,14.4,True,7,1
Robe longue ajourée et dos...,25.2,True,9,5
Jeans sexy taille haute...,23.52,True,1,3
Leggings tendance à taille...,8.4,True,6,4
Monokini sexy avec chaînes,18.48,True,8,1
Pull en tricot à épaules...,15.6,True,5,1
Pull chauve-souris tendance...,15.0,True,7,1
Pull tendance chauve-souris...,15.0,True,7,1
Pull tendance imprimé...,11.4,True,5,1
Sweat à capuche tendance...,11.4,True,4,3
Gilet à capuche sexy avec...,25.2,True,3,1
Pull côtelé KouCLa sexy...,14.4,True,6,1
Pull long moelleux sexy...,10.8,True,3,1
Pull en maille XL KouCla...,12.6,True,6,2
"Top sexy KouCla imprimé ""I...",4.8,True,9,4
Robe bandeau tendance,21.84,True,5,4
Bustier sexy motif...,27.26,True,1,3
Bikini triangle sexy à nouer,8.64,True,4,1
Mini robe gogo sexy...,15.12,True,7,1
Mini robe gogo sexy extensible,12.0,True,5,1
Mini robe gogo sexy sans...,15.6,True,7,1
Short gogo sexy avec strass,7.2,True,4,1
Short gogo sexy,4.8,True,7,1
Soutien-gorge gogo sexy,6.0,True,8,1
Soutien-gorge dentelle gogo...,7.56,True,2,1
Body gogo effet cuir sexy...,25.2,True,4,1
Tenue sexy gogo de détenus...,30.24,True,1,1
Ensemble gogo sexy look...,23.52,True,1,4
Mini robe sexy KouCla avec...,7.8,True,8,4
Mini robe bandeau de soirée...,9.0,True,6,3
Robe de soirée sexy avec...,9.6,True,5,3
Robe crayon sexy avec...,9.0,True,4,4
Robe crayon sexy avec...,9.0,True,7,5
Robe crayon sexy en dentelle,9.0,True,6,4
Mini robe sexy KouCla avec...,8.4,True,4,4
Mini robe sexy en dentelle,9.0,True,5,4
Mini robe bandeau cocktail...,8.4,True,6,1
Mini robe bandeau sexy avec...,6.0,True,3,1
Longues Chaussettes sexy...,5.76,True,6,1
Salopette d'été tendance...,23.52,True,8,3
Bustier sexy bondage avec...,17.64,True,2,1
Short gogo sexy avec zip,4.8,True,7,4
Chemisier bohème tendance...,13.2,True,4,1
Crop top manches longues sexy,13.44,True,4,4
Crop top manches longues...,14.48,True,6,1
T-shirt tendance KouCla...,9.6,True,8,1
Débardeur KouCla sexy avec...,3.9,True,8,1
T-shirt sexy KouCla avec...,9.6,True,8,1
"T-shirt sexy KouCla ""sexy...",7.8,True,8,1
Débardeur sexy KouCla avec...,3.6,True,9,1
Débardeur sexy KouCla avec...,3.3,False,9,1
T-shirt sexy KouCla avec...,4.5,True,8,1
T-shirt tendance KouCla...,9.6,True,8,1
T-shirt sexy KouCla sans...,9.6,True,8,1
T-shirt sexy KouCla KissMe...,8.4,True,8,1
"Top sexy  ""Everybody wants...",3.6,True,8,1
"T-Shirt sexy ""Smoking Kills""",3.9,True,8,1
T-shirt tendance KouCla...,3.6,True,8,1
T-shirt endance 'KouCla...,3.9,True,8,1
T-shirt sexy KouCla avec...,10.81,True,8,1
Débardeur sexy KouCla avec...,3.3,True,9,1
Crop top sexy KouCla aspect...,6.72,True,3,1
Top sexy avec strass,13.2,True,10,1
T-shirt sexy KouCla avec...,5.4,False,8,1
"T-shirt sexy ""Rock n Roll""...",8.4,True,8,1
T-shirt sexy KouCla avec...,9.0,True,8,2
Chemisier sexy en...,6.3,True,5,4
Chemisier sexy à manches...,20.16,True,6,4
Chemisier sexy en...,10.8,True,5,2
Chemisier sexy en...,20.16,True,5,4
Chemisier tendance avec traîne,10.8,True,4,4
Blouse KouCla sexy,18.48,True,3,4
Chemisier cache-cœur à...,16.8,True,4,2
Combishort bandeau sexy...,11.76,True,3,2
Combishort sexy imprimé...,10.92,True,4,2
Combishort sexy imprimé...,16.8,True,3,4
Monokini sexy de luxe,18.48,True,1,4
Monokini sexy de luxe sans dos,18.48,False,1,3
Mini robe bandeau sexy...,20.16,True,1,2
Chemisier sexy à nouer,13.2,True,4,5
Chemise sexy effet satiné,20.16,True,5,4
Chemisier sexy avec noeud à...,21.84,True,2,4
Chemisier sexy à manches...,19.32,True,4,2
Blouse sexy large cache coeur,14.4,True,4,4
Chemisier sexy avec boutons...,21.84,True,3,4
Chemisier sexy à manches...,14.28,True,4,4
Blouse sexy KouCla avec...,15.6,True,3,3
Chemisier sexy dos nu avec...,20.16,True,3,1
T-shirt tendance KouCla...,4.5,True,8,1
T-shirt sexy KouCla avec...,4.8,True,8,2
T-shirt sexy sans dos...,4.5,True,7,1
T-shirt tendance avec...,4.8,True,8,2
T-shirt tendance KouCla...,4.5,True,7,2
T-shirt sexy KouCla avec...,4.5,False,9,2
T-shirt sexy KouCla avec...,4.8,False,9,2
T-shirt sexy KouCla sans...,4.8,False,9,2
"T-shirt sexy  ""I hate being...",4.8,True,9,2
T-shirt sexy KouCla avec...,4.8,True,9,3
Body KouCla sexy bretelles...,15.96,True,6,1
T-shirt KouCla XXL asymétrique,12.6,True,7,1
Body sexy en maille fine...,14.28,True,7,4
Body blouse sexy look business,21.0,True,4,4
Body blouse sexy look business,21.0,True,4,4
Body-chemise sexy,20.16,True,4,1
Body effet mouillé sexy...,12.6,True,2,1
Body en maille côtelé sexy...,15.12,True,2,3
Body sexy KouCla avec filet,13.44,True,2,1
Crop top sexy Koucla,12.6,True,7,1
Body sexy en dentelle à...,21.0,True,3,1
Body sexy à manches longues,20.16,True,2,1
Débardeur sexy koucla,3.6,True,9,1
Débardeur sexy 'Luxury' KouCla,3.9,True,9,1
Débardeur sexy KouCla...,4.2,True,11,1
"Débardeur sexy Koucla ""F_CK...",3.9,True,9,1
Débardeur 'Rock & Roll',3.3,True,9,1
"Débardeur sexy ""VIP""",3.3,False,9,1
Débardeur sexy KouCla avec...,3.6,True,9,1
Débardeur KouCla,3.6,True,9,1
Débardeur sexy KouCla avec...,3.6,True,9,1
Crop top bandeau sexy avec...,13.44,True,5,2
Crop top sexy look satin,11.76,True,3,4
Top sexy en dentelle col...,18.48,True,6,1
Crop top sexy col bardot...,7.56,True,5,1
Top sexy avec broderie,10.08,True,10,1
Débardeur sexy avec traîne...,4.2,True,5,3
Top sexy en dentelle,6.0,True,3,3
Blazer sans manches sexy...,21.84,True,5,3
Top sexy avec traîne en...,5.1,True,4,5
Monokini sexy avec découpes,12.0,True,3,4
Bas de bikini brésilien sexy,6.72,True,6,5
Monokini sexy motif ananas,12.0,True,3,5
Bikini balconnet sexy avec...,12.6,True,3,3
Bikini sexy à rayures,15.12,True,4,4
Combi pantalon sexy look...,30.24,True,2,4
Combishort sexy look...,18.0,True,3,3
Combishort sexy dos nu,24.36,True,6,1
Combishort sexy,20.16,True,3,4
Jupe crayon sexy avec...,13.2,True,3,3
Mini robe de soirée sexy...,16.8,True,6,4
Robe bandeau sexy avec...,23.52,True,5,4
Body de soirée sexy avec...,23.52,True,5,3
Robe sexy KouCla avec sequin,8.4,False,7,4
Robe bandeau sexy KouCla...,16.8,True,5,1
Crop Pull sexy en maille...,12.0,True,7,4
Robe de cocktail sexy...,9.6,True,6,4
Robe longue de soirée sexy...,40.32,True,3,1
Pull tricoté sans ventre...,10.8,True,7,8
Robe crayon sexy KouCla...,25.2,True,6,4
Mini jupe d'affaires sexy...,18.48,True,4,4
Combi pantalon skinny sexy...,26.88,True,4,4
Jupe crayon sexy taille...,16.8,True,7,3
Bikini sexy à nouer avec...,6.6,True,5,3
Bikini triangle sexy KouCla...,18.48,True,5,3
Bikini sexy,15.12,True,3,3
Bikini sexy imprimé animal...,12.6,True,4,4
Bikini sexy avec chaînes,15.12,True,4,3
Bikini sexy avec chaînes,6.9,True,5,4
Bikini sexy avec culotte à...,13.2,True,4,3
Bikini sexy avec boutons et...,6.6,True,4,4
Bikini sexy avec look...,12.0,True,4,4
Bikini sexy avec des chaînes,6.6,True,6,5
Bikini sexy motifs carreaux,12.0,True,3,3
Monokini bondage sexy KouCla,7.8,True,5,4
Monokini sexy avec dentelle,6.6,True,7,3
Monokini sexy avec anneaux...,7.2,True,5,3
Monokini sexy avec chaîne,4.8,True,2,3
Monokini sexy avec chaînes...,9.6,True,2,3
Monokini sexy avec Boucles,6.6,True,3,3
Monokini sexy avec des clous,6.0,True,4,4
Monokini KouCla tendance...,7.5,True,6,3
Monokini sexy imprimé...,13.44,True,2,3
Mini robe sexy KouCla,23.52,True,2,3
Mini robe sexy KouCla avec...,20.16,True,5,4
Robe de cocktail sexy,7.8,True,5,3
Combi pantalon bandeau sexy...,19.2,True,4,4
Robe de cocktail sexy avec...,25.2,True,5,3
Robe sexy Koucla avec...,20.16,True,5,1
Robe pull sexy KouCla à...,15.6,True,7,1
Robe longue en tricot sexy,18.0,True,7,4
Robe de soirée sexy à...,30.24,True,6,4
Robe longue sexy KouCla...,23.52,True,4,5
Robe de soirée sexy bandeau...,40.32,True,3,4
Salopette sexy à manches...,30.24,True,4,3
Mini robe sexy fronçée avec...,9.0,True,5,3
Mini robe sexy évasée avec...,18.48,True,5,4
Robe bandeau-cocktail sexy...,18.0,True,4,3
Combinaison sportswear...,21.84,True,4,1
Pull sexy manches longues,11.4,True,7,4
Robe de soirée sexy Koucla,18.0,True,4,4
Mini robe sexy KouCla à...,21.84,True,6,1
Robe col roulé sexy KouCla,15.96,True,9,4
Mini robe sexy avec dentelle,8.4,True,7,1
Cardigan tendance en grosse...,27.6,True,6,1
Pull tendance KouCla,15.0,True,6,3
Monikini sexy à rayures...,6.6,True,2,3
Monikini sexy avec des pierres,6.6,False,5,3
Mini robe sexy en dentelle...,7.8,True,5,3
Monokini sexy,18.48,True,3,3
Monikini avec strass sexy,18.48,True,4,1
Crop top sexy KouCla avec...,7.56,True,2,2
T-shirt sexy effet mouillé,11.4,True,1,4
top bustier tendance,18.48,True,5,3
Combinaison sportswear...,25.2,False,2,1
Crop top sexy dos nu avec...,15.12,True,4,5
JeanS skinny déchiré,22.68,True,2,5
Pantacourt en jeans skinny...,20.16,True,2,2
Leggings court sportswear sexy,7.56,True,10,1
Pull sexy avec chaîne dans...,11.76,True,6,1
Pull côtelé tendance,15.0,True,7,4
Robe bandeau-cocktail sexy,16.8,True,3,1
Pull tendance avec ruban,11.4,True,7,1
Pull tendance dos bénitier...,10.2,True,6,1
Pull sexy à épaules dénudées,14.28,True,6,3
Mini robe sexy bicolore...,18.48,True,3,1
Pull en maille tendance,14.4,True,7,3
Sweat sexy 'LOVE KOUCLA Girls',9.0,True,4,4
Mini robe sexy avec manches...,20.16,True,5,3
Pull sexy avec filet en...,12.0,True,7,4
Robe business sexy avec zip,21.84,True,7,1
Pull tendance Koucla avec...,15.0,True,7,4
Robe de soirée sexy...,31.92,True,3,1
Pull destroy tendance avec...,16.8,True,7,1
Pull Col roulé sexy KouCla...,15.0,True,7,1
Crop top sexy fashion,13.2,True,4,4
Mini robe sexy en dentelle...,20.16,True,3,1
Crop top sexy à manches...,15.12,True,6,1
Crop pull sexy en maille...,15.96,True,6,4
Top transparent sexy...,4.2,True,5,4
Combinaison KouCla sexy...,30.24,True,3,5
Pantalon skinny sexy taille...,25.2,True,3,4
Robe sexy avec maille et...,25.2,True,3,1
Robe bandeau sexy avec...,21.84,True,7,4
Robe de soirée sexy,21.84,True,3,5
Combinaison bandeau sexy en...,43.68,True,2,4
Robe de soirée sexy avec...,38.64,True,3,1
Pull en maille sexy avec...,18.48,True,7,3
Robe longue ajourée sexy...,22.8,True,5,1
Pull sexy à rayures dos nu,11.4,True,6,4
Crop pull col roulé sexy...,18.48,True,3,1
Pull sexy avec col en...,12.6,True,6,1
Pull tendance avec tour de...,13.8,True,8,1
Pull sexy avec laçage,15.0,True,7,1
Robe sexy en maille avec...,18.48,True,7,1
Robe sexy avec col fausse...,15.6,True,6,1
Mini robe bandeau sexy...,9.0,True,8,4
Pantalon sportswear...,18.0,True,3,1
Pull tendance avec broderie...,15.12,True,7,1
Robe pull en maille sexy...,20.16,True,7,2
Robe courte sexy avec...,16.8,True,5,4
Robe à bretelles sexy...,21.84,True,5,1
Mini robe sexy asymétrique...,16.8,True,6,1
Robe longue sexy dos nu,40.32,True,5,1
Sweat shirt sexy avec...,12.0,True,5,1
Robe longue en tricot sexy,16.2,True,6,1
Mini robe sexy dos nu,8.4,True,9,1
Mini robe sexy col bénitier...,23.52,True,8,4
Robe fourreau sexy avec...,25.2,True,5,1
Mini robe sexy dos nu avec...,15.6,True,5,1
Sweat shirt tendance Koucla...,10.8,True,8,1
Robe pull sexy en tricot...,15.96,True,5,1
Pull large sexy en maille...,15.0,True,7,4
Pantalon sportswear...,23.52,True,4,5
Pantalon sexy simili cuir...,25.2,True,2,1
Crop pull sexy avec dentelle,14.4,True,6,4
Jupe crayon sexy business...,21.84,True,5,8
Pull tendance à épaules...,15.12,True,6,1
Robe pull sexy en maille...,16.8,True,6,4
Robe fourreau sexy,21.84,True,5,4
Pantalon sexy simili cuir,18.0,True,3,1
Pull en maille tendance...,16.2,True,7,5
Treggings skinny sexy avec...,18.0,True,2,4
Robe bandeau sexy avec...,20.16,True,3,1
Robe pull en maille...,20.16,True,6,1
Robe longue tendance en...,17.4,True,5,1
Robe pull sexy à épaules...,15.6,True,8,1
Pull sexy col bardot,16.8,True,7,1
Pull large sexy col bardot,16.8,True,6,3
Crop pull à capuche...,16.8,True,4,1
Pull tendance en grosse...,26.04,True,6,1
Pull KouCla sexy avec laçage,16.8,True,6,4
Robe sexy KouCla avec dentelle,18.0,True,5,4
Mini robe de cocktail sexy...,21.84,True,4,1
Crop pull asymétrique tendance,14.28,True,7,1
Mini robe bandeau sexy avec...,16.8,True,5,1
Crop pull tendance à col roulé,12.0,True,7,1
Pull long tendance à...,13.2,True,7,1
Pull à col roulé en tricot...,16.2,True,6,4
Mini robe de soirée sexy...,42.0,True,2,2
Mini robe sexy avec...,23.52,True,5,1
Pull grosse maille sexy...,15.6,True,7,1
Pull Koucla tendance...,15.6,True,5,1
Mini robe débardeur en...,19.32,True,6,5
Treggings sexy KouCla avec...,18.0,True,4,1
Pull large tendance KouCla...,15.6,True,6,4
Combinaison latex sexy avec...,38.64,True,2,3
Combinaison tendance...,21.0,True,2,1
Combinaison bandeau sarouel...,14.28,True,3,3
Mini robe sexy asymétrique...,7.2,True,7,1
Pull large sexy à rayures...,12.0,True,7,3
Combinaison sexy KouCla...,30.24,True,2,1
Robe pull sexy col bardot...,16.19,True,7,1
Robe pull en maille sexy...,17.64,True,6,4
Robe longue de soirée sexy,38.64,True,3,3
Mini robe sexy KouCla avec...,16.8,True,5,4
Blazer cintré sexy effet...,13.68,True,6,5
Treggings sexy avec laçage,16.8,True,3,4
Body sexy avec un décolleté...,21.84,True,5,4
Short jupe plissée sexy,5.7,True,4,3
Jupe sexy taille haute avec...,21.84,True,3,1
Pull tendance Koucla avec...,14.4,True,5,4
Robe droite sexy KouCla...,21.84,True,4,1
Robe en maille épaisse...,30.24,True,6,3
Robe mi-longue sexy Koucla...,25.2,True,4,1
Pull tendance Koucla avec...,14.4,True,6,1
Pull sexy KouCla avec perles,11.4,True,5,1
Pull tendance Koucla avec...,10.8,True,6,1
Pull long KouCla sexy avec...,15.0,True,6,1
Pull tendance KouCla avec...,13.8,True,5,1
Sweat shirt sexy à épaules...,10.92,True,5,1
Pull KouCla sexy look...,15.12,True,7,1
Robe en maille sexy avec...,15.6,True,6,3
Robe sexy en maille KouCla,21.84,True,4,1
Robe en maille sexy avec...,24.36,True,7,1
Robe sexy en maille avec zip,22.68,True,6,1
Mini robe bandeau sexy avec...,18.48,True,7,3
Jupe sexy imprimé carreaux...,15.0,True,3,1
Short sexy avec découpes,5.88,True,2,2
Crop top sexy col bardot...,10.92,True,3,1
Combishort sexy effet satin...,21.84,True,4,4
Top sexy avec manches...,4.8,True,6,3
Combishort bandeau sexy...,18.48,True,4,4
Robe sexy avec insert en...,23.52,True,3,1
Mini robe sexy 2 en 1 avec...,20.16,True,6,3
Top sexy manches longues en...,18.48,True,6,3
Robe de soirée sexy Koucla...,16.8,True,5,4
Pantalon  sexy simili cuir...,18.0,True,5,4
Robe de soirée sexy Koucla,36.96,True,3,3
Top sexy KouCla avec filet...,11.76,True,6,1
Robe Koucla tendance à...,15.12,True,4,2
Mini-robe bandeau sexy...,25.2,True,5,1
Pull Col roulé sexy KouCla...,15.12,True,6,1
Pull sexy KouCla avec...,15.6,True,6,3
Crop top sexy effet mouillé...,13.44,True,2,1
Pull oversize tendance...,16.8,True,5,1
Robe en maille sexy,16.2,True,6,1
Mini robe bandeau sexy avec...,7.2,True,8,4
Mini robe sexy,5.4,True,4,3
Mini robe sexy KouCla...,20.16,True,4,3
Combishort sexy KouCla avec...,25.2,True,5,1
Pull en tricot KouCla...,16.2,True,6,1
T-shirt large tendance,12.6,True,5,5
Treggings sexy KouCla avec...,25.2,True,3,1
Mini robe sexy,18.48,True,7,1
Pull en maille tendance...,12.0,True,5,4
Robe sexy KouCla,21.84,True,3,4
Robe fourreau sexy KouCla,25.2,True,4,1
Robe à col roulé en tricot...,15.6,True,4,1
Jupe de plage sexy avec tulle,13.44,True,7,1
Pull col roulé sexy,15.6,True,5,1
Pull long sexy à épaules...,12.0,True,6,1
Pull tendance KouCla,9.36,True,7,1
Pull Koucla sexy avec...,8.64,True,5,1
Pull large Col roulé...,22.68,True,6,1
Pull Koucla avec chaîne et...,12.0,True,6,1
Robe de soirée sexy avec...,7.8,True,6,1
Pull Koucla tendance avec...,15.0,True,6,1
Pull large KouCla tendance...,16.2,True,8,4
Robe bandeau sexy,25.2,True,3,1
Pull large chauve souris...,15.6,True,6,1
Pull sexy en maille Koucla...,16.8,True,6,1
Pull tendance avec...,15.6,True,7,1
Pull long sexy asymétrique,9.0,True,6,4
Mini robe sexy KouCla Look...,21.84,True,5,4
Jupe sexy en latex avec...,15.96,True,6,4
Robe de soirée sexy KouCla...,26.88,True,5,1
Mini-robe sexy dos nu avec...,21.84,True,6,1
Pull côtelé tendance KouCla,13.2,True,6,3
Combinaison sexy manches XL,28.56,True,2,3
Robe à manches longues Sexy...,9.0,True,4,1
Robe sexy dos nu avec strass,30.24,True,3,1
Pull sexy en maille fine,15.6,True,6,4
Robe Koucla sexy avec perles,38.64,True,2,3
Ensemble sportswear tendance,20.16,False,1,4
Jupe taille haute sexy en...,13.44,True,5,4
Jupe crayon sexy KouCla...,14.4,True,1,1
Jupe sexy taille haute...,13.8,True,6,1
Jupe sexy en maille taille...,14.4,True,6,5
Jupe crayon sexy avec...,13.8,True,3,4
Jupe crayon sexy KouCla...,14.4,True,1,1
Robe longue sexy aspect satiné,30.24,True,3,4
Mini robe sexy en simili cuir,23.52,True,2,5
Bermuda destroy en jeans...,18.48,True,2,1
"Robe sexy asymétrique, fronçée",7.8,True,8,1
Sweat shirt tendance motifs...,16.2,True,6,1
Pull sexy col V motif zèbre...,12.0,True,4,2
Top col bardot sexy en...,13.2,True,11,1
Cardigan en maille épaisse...,27.6,True,5,1
"Sweat shirt tendance ""Crazy""",12.0,True,4,1
Pull sexy col v en maille...,15.96,True,6,4
"Blazer sexy , décor clouté...",15.84,True,4,2
Pull à capuche sportswear...,16.8,True,4,4
Robe sexy décolleté en...,26.88,True,6,3
Robe longue sexy col V avec...,31.92,True,2,8
Top sexy look portefeuille,15.12,True,6,4
Robe longue de soirée sexy,38.64,True,3,4
Robe longue de soirée sexy...,40.32,True,2,1
Robe longue de soirée sexy...,30.24,True,4,2
"Leggings sexy look velours,...",9.24,True,5,1
Pull sexy avec une chaîne,14.4,True,6,4
Robe de cocktail sexy avec...,23.52,True,4,1
Robe en tricot sexy...,15.12,True,7,1
Robe à rayures en tricot...,16.8,True,5,1
Mini robe sexy en maille...,16.8,True,4,2
Robe bandeau sexy,25.2,True,5,1
Robe longue sexy manches...,30.24,True,5,1
Robe tendance en maille...,18.0,True,4,4
Treggings sexy effet cuir...,22.68,True,3,1
Sweat shirt col rond...,10.8,True,6,1
Robe en tricot fin tendance...,22.68,True,6,3
Mini-robe sexy asymétrique...,21.84,True,3,2
Leggings sexy simili cuir...,11.76,True,3,4
Combinaison bandeau sexy...,30.24,True,4,1
Pull tendance rayé avec...,13.2,True,7,4
Blazer sexy look business...,13.68,True,3,1
Sweat shirt tendance avec...,13.2,True,6,1
Mini robe sexy en maille...,16.8,True,6,3
Robe sexy avec fermeture...,21.84,True,3,4
Treggings sexy simili cuir...,30.24,True,2,4
Pantalon sexy simili cuir...,31.92,True,4,4
Pantalon sexy en similicuir...,26.88,True,1,4
Pantalon sexy similicuir...,26.88,True,4,1
Robe sexy bandeau asymétrique,8.1,True,6,5
Treggings sexy avec bandes...,16.8,True,4,1
Pull large tendance motif...,15.0,True,6,5
Treggings taille haute sexy...,21.84,True,3,1
Pull large sexy col en V,20.16,True,6,3
"Mini robe sexy à bretelles,...",15.6,True,5,2
Sweat shirt tendance froissé,13.2,True,4,1
Pull long ajouré sexy à col...,16.2,True,6,5
Pantalon sexy aspect cuir,18.0,True,6,4
Treggings slim sexy avec...,15.6,True,3,4
Robe de cocktail sexy avec...,23.52,True,3,3
Combinaison de soirée sexy...,32.76,True,4,1
"Robe en maille tendance,...",18.48,True,6,2
Leggings effet mouillé...,10.92,True,4,1
Pull en maille fine...,8.64,True,6,1
Pull tendance au look marine,10.2,True,6,8
Pull à manches longues sexy,16.8,True,6,4
Robe longue de soirée sexy...,26.88,True,2,1
Pull en maille col roulé...,16.2,True,7,4
Robe fourreau sexy avec...,9.0,True,4,3
Mini-robe sexy fronçée avec...,8.4,True,5,1
"Robe sexy, avec broderie et...",8.4,True,7,1
Pull sexy col V,14.4,True,6,4
Pantalon sexy simili cuir...,25.2,True,2,1
Pull en maille ample...,22.8,True,5,1
Robe patineuse sexy,20.16,True,5,1
Robe en maille fine...,16.8,True,5,1
Pull sexy col bardot avec...,15.6,True,6,3
Pull tendance avec une...,9.6,True,6,1
Pull en maille fine...,9.36,True,6,1
Boléro sexy en dentelle à...,15.12,True,3,1
Mini-robe bandeau sexy avec...,6.6,True,6,4
Pantalon sexy en simili cuir,25.2,True,2,1
Cardigan tendance à nouer,21.0,True,5,1
Robe pull sexy en maille...,22.68,True,5,4
Blazer sexy avec des...,15.84,True,4,2
Mini-robe sexy avec un...,21.84,True,4,1
Robe en maille fine sexy,16.8,True,5,3
"Mini-robe sexy avec basque,...",21.84,True,4,1
Robe longue sexy avec fente...,30.24,True,3,1
"Robe sexy en maille fine,...",16.8,True,5,5
Bermuda en Jeans sexy...,17.64,True,1,3
Robe longue sexy ajourée...,25.2,True,7,1
Chemisette longue sexy à...,23.52,True,4,1
Pull sexy destroy,10.2,True,6,1
Robe longue de soirée sexy...,30.24,True,3,1
Pull tendance avec un noeud...,13.8,True,4,1
Pull sexy à épaules dénudées,8.4,True,5,4
Robe de soirée sexy,38.64,True,2,1
Mini-robe sexy avec des...,8.4,True,9,4
Pantalon sexy en similicuir...,30.24,True,2,3
Ensemble sportswear tendance,21.84,False,1,1
Mini robe sexy asymétrique,21.84,True,3,5
Treggings effet cuir sexy...,25.2,True,3,1
Pull cache coeur sexy,15.0,True,9,1
Crop top sexy à col bardot...,10.08,False,3,4
Robe sexy avec une boucle...,15.6,True,4,1
Pull long sexy avec...,16.8,True,7,1
"Pull long sexy ""GLAM""",21.84,True,5,1
Robe sexy en maille,15.6,True,4,1
Robe sexy à nouer avec...,14.4,True,5,1
Robe sexy ajourée avec des...,25.2,True,5,2
Leggings sexy effet mouillé...,9.24,True,4,4
Salopette sexy avec de la...,30.24,True,3,1
Pull tendance en tricot...,15.6,True,5,3
Mini robe sexy avec de la...,20.16,True,2,4
Pantalon sexy à carreaux...,15.6,True,1,3
Treggings sexy avec des...,15.6,True,4,1
"Pull tendance ""BE RICH""",12.0,True,6,1
Pull sexy à col bardot avec...,9.6,True,6,3
Robe sexy avec de la dentelle,25.2,True,4,1
"Pull tendance ""WHAT ? """,10.8,True,4,4
Top sexy à manches longues...,9.0,True,6,4
Robe longue sexy avec de la...,40.32,True,2,1
Pull sexy avec de la...,12.6,True,5,2
Mini robe sexy avec des...,6.0,True,7,1
Mini robe sexy à manches...,21.84,True,6,4
Leggings sexy simili cuir...,13.44,True,3,4
Pantalon sexy simili cuir...,22.8,True,4,4
Treggings sexy avec bandes...,16.2,True,2,4
Combinaison sexy,26.04,True,6,1
Pull tendance,15.0,True,5,3
Top sexy à manches longues...,16.8,True,5,1
Robe longue sexy avec de la...,25.2,True,4,4
Robe de soirée sexy effet...,28.56,True,3,1
Mini robe sexy à bretelles...,21.84,True,4,2
Mini robe sexy avec de la...,15.0,True,4,4
Pantalon sexy simili cuir,19.2,True,3,4
Combinaison sexy avec un...,28.56,True,3,1
Robe sexy avec bracelet...,9.0,True,4,1
Robe sexy avec une bretelle...,7.8,True,4,4
Robe crayon sexy bi couleur,21.84,True,4,3
Mini-robe sexy fronçée avec...,23.52,True,3,1
Mini robe sexy avec col...,6.6,True,4,4
Combinaison bustier sexy,30.24,True,3,3
Robe de soirée sexy avec...,21.6,True,6,4
Pantalon droit sexy KouCla,15.6,False,2,4
Jupe crayon sexy,16.8,True,3,4
Jupe crayon sexy KouCla...,14.4,True,1,1
Sweat sexy avec traîne,9.6,True,5,4
Robe de soirée sexy ajourée...,30.24,True,4,1
Mini-robe sexy KouCla avec...,20.16,True,5,4
Robe de soirée sexy à...,25.2,True,3,3
Mini robe sexy fronçée...,7.2,True,5,1
Mini robe sexy avec des...,8.4,True,4,4
Mini jupe sexy aspect cuir...,16.8,True,3,1
Pull large tendance avec...,16.2,True,6,4
Blazer business sexy à...,24.0,True,6,4
Blazer sexy avec poches...,25.2,True,4,3
Robe fourreau sexy avec laçage,23.52,True,3,1
"Crop pull sexy ""LONDON""",11.4,True,4,4
Blazer cintré sexy à carreaux,21.6,True,3,3
Mini robe sexy avec basque,7.8,True,5,1
"Mini robe sexy, dos nu avec...",7.2,True,5,1
Mini robe sexy,19.32,True,3,3
Robe sexy KouCla avec...,23.52,True,4,3
Mini jupe sexy en simili...,20.16,True,2,4
Combinaison bandeau sexy à...,23.52,True,2,1
Mini robe sexy à bretelles,7.2,True,5,3
Jupe en jeans sexy à...,20.16,True,3,1
Top sexy à manches longues...,10.08,True,15,1
"Top sexy à manches longues,...",10.8,True,7,1
"Pull large tendance,...",18.0,True,7,1
"Pull tendance "" Venice...",8.64,True,5,1
Robe sexy en maille côtelée,15.6,True,4,2
Top sexy transparent à...,14.4,True,3,1
Top sexy transparent à...,10.2,True,4,1
