Articles,Prices,InStocks,N_colors,N_sizes
Robe sexy en simili cuir...,31.92,True,4,3
Robe tendance dos nu,21.84,True,4,3
Robe en jeans tendance avec...,31.92,True,1,4
Robe en jeans tendance avec...,31.92,True,1,4
Mini robe sexy à manches...,21.84,True,6,1
Robe jeans avec ceinture,32.76,True,2,3
Robe jeans  tendance,44.4,True,2,1
Mini robe sexy,27.26,True,2,1
Robe sexy à oeillets,33.6,True,2,3
Mini robe sexy à carreaux,21.84,True,1,3
Mini robe sexy look satin,23.52,True,5,3
Robe sexy avec imprimé,31.92,True,4,3
Robe tendance,30.24,True,5,3
Mini robe sexy à franges,31.92,True,5,3
Mini robe sexy nouage cou,23.52,True,1,3
Robe sexy avec filet dos,21.84,True,3,1
Robe sexy imprimé serpent,16.8,True,1,4
Robe sexy style effet mouillé,25.2,True,3,4
Robe sexy effet satiné,21.84,True,2,1
Mini robe gogo sexy en...,16.8,True,3,1
Robe sexy bandeau,16.8,True,3,1
Mini robe sexy manches...,21.84,True,7,1
Robe sexy bandeau avec zip...,18.48,True,1,1
Robe sexy ajourée avec imprimé,26.88,True,1,1
Robe sexy clubbing,21.84,True,4,1
Mini robe sexy avec maille,18.48,True,2,1
Robe tendance ceinture...,20.16,True,6,4
Robe sexy imprimée léopard...,18.48,True,1,3
Mini robe sexy avec franges...,26.88,True,2,1
Mini robe sexy tendance,7.8,True,6,2
Salopette denim tendance,23.52,True,4,5
Combishort sexy avec des...,25.2,True,5,1
Combinaison tendance,26.88,True,7,1
Combinaison sexy simili...,30.24,True,2,1
Combinaison sexy simili...,30.24,True,2,1
Combinaison sexy avec...,25.2,True,2,4
Combinaison sexy avec...,28.56,True,3,3
Combinaison short sexy avec...,25.2,True,3,2
Combishort sexy,21.84,True,3,3
Combinaison sexy simili...,26.88,True,2,1
Salopette sexy décolletée,25.2,True,3,2
Crop top sexy à nouage dorsal,9.24,True,5,1
Crop top sexy crochet,14.4,True,3,1
Crop top sexy,12.6,True,6,4
Crop top sexy simili cuir,15.12,True,1,1
Body sexy col roulé,15.96,True,5,1
Top sexy manches longues...,15.12,True,3,1
Crop-Top tendance,2.7,True,4,2
Top tendance KouCla,3.0,True,5,1
Top manches asymétriques,3.3,True,4,3
Débardeur imprimé KouCla,3.3,False,5,1
Débardeur KouCla sexy brodé,3.9,False,7,1
Débardeur V.I.P,3.3,True,5,1
Débardeur imprimé mains,3.3,True,8,1
Débardeur sexy imprimé X,3.0,True,7,1
Crop top KouCla sexy,3.3,True,6,3
Crop top sexy KouCla,10.08,True,1,4
Ensemble Crop chemise et...,25.2,True,1,3
Pull-over sexy à col roulé...,16.8,True,4,1
Pull-over sexy avec laçage,15.12,True,7,1
Jeans sexy taille haute...,22.68,True,1,5
Jeans taille haute sexy,21.84,True,1,5
Pantalon sexy slim simili cuir,21.84,True,3,4
Pantalon sexy branché,10.92,True,6,2
Jupe sexy Fashionista en...,31.2,True,5,3
Jupe taille haute avec de...,28.8,True,2,3
Mini jupe sexy simili-cuir,15.96,True,3,4
Mini jupe sexy simili cuir...,15.96,True,5,4
Short en jeans sexy look...,26.4,True,1,5
Short en Jeans sexy taille...,28.8,True,1,5
Short bikers brillants sexy,6.72,True,6,2
Short en jeans tendance,18.48,True,2,5
Short en simili cuir sexy,21.84,True,5,3
Short en jeans basique...,24.0,True,1,5
Haut de bikini sexy,8.4,True,7,3
Monokini sexy KouCla,18.48,True,3,3
Monokini imprimé flamant rose,16.8,True,1,5
Bas de bikini KouCla,5.04,True,8,4
Bas de bikini KouCla taille...,6.72,True,7,4
Bas de bikini brésilien sexy,5.88,True,10,4
Veste tendance à capuche,16.8,True,6,3
Pantalon de jogging...,7.2,True,4,3
Robe sexy bustier motifs...,16.8,True,5,4
Pantalon sexy avec faux...,8.64,True,4,4
Short sexy avec fine...,6.6,True,5,4
Pantalon sexy avec couronne...,12.65,True,6,4
Jupe crayon sexy avec...,7.2,True,5,4
Jupe crayon sexy taille...,18.0,True,5,4
Jupe crayon sexy taille...,7.2,True,5,4
Pantalon sexy avec ceinture...,7.2,True,5,4
Pantalon sexy avec clous et...,9.0,True,5,4
Pantalon sexy avec boucle...,7.8,True,5,4
Pantalon tendance fines...,9.0,True,5,4
Body sexy manches longues...,18.48,True,2,4
Veste sexy en cuir,34.8,True,1,1
Crop top sexy avec franges,7.92,True,4,4
Chemisier sexy à manches...,7.92,True,5,4
Short sexy look carré avec...,8.64,False,2,1
Pull tendance en fils...,9.36,False,5,1
Pull tendance en tricot...,10.04,True,5,4
Gilet sexy,10.8,True,2,4
Blazer sexy avec imprimé...,15.12,True,4,4
Blazer KouCla sexy clouté,15.12,True,4,1
Sweat en maille sexy...,6.84,True,7,4
Mini robe sexy KouCla,15.6,True,9,5
Combinaison sexy KouCla,26.88,True,7,4
Débardeur sexy classique,7.56,True,10,4
Robe tendance asymétrique,16.8,True,8,4
Combinaison sexy KouCla,25.2,True,4,1
Top tendance manches...,22.8,True,3,4
Bikini triangle sexy au...,12.6,True,3,3
Bikini sexy rayé avec...,6.0,True,3,2
Leggings sexy aspect...,8.4,True,6,4
Robe longue sexy avec...,28.56,True,3,3
Bikini sexy,6.6,True,4,4
Bikini sexy brillant,6.07,True,6,3
Bikini sexy avec imprimé...,6.6,True,1,4
Bikini triangle sexy KouCla...,6.6,True,1,4
Bikini sexy avec découpes,13.2,True,4,5
Bikini Sexy avec fils et...,18.48,True,2,4
Bikini sexy avec imprimé...,13.2,True,3,4
Bikini sexy à volants...,11.4,True,3,4
Bikini sexy à volants...,12.0,True,2,5
Bikini sexy avec volant et...,18.48,True,3,5
Bikini bi couleur sexy,12.0,True,3,2
Pantalon taille haute sexy...,10.92,True,6,4
Monokini sexy avec détails...,18.48,True,8,3
Bikini triangle sexy avec...,6.07,True,3,2
Kimono sexy transparent,26.88,True,2,5
Monokini sexy avec maille,11.4,True,3,4
Monokini sexy en style pin-up,6.9,True,3,3
Monokini sexy avec strass,6.6,False,3,3
Monokini sexy avec imprimé...,6.6,True,2,3
Monokini sexy avec des pierres,6.07,True,4,3
Monokini tendance sexy avec...,6.24,True,6,3
Monokini sexy,6.26,True,2,4
Jupe crayon sexy KouCla...,15.6,True,1,4
Jupe crayon sexy avec ceinture,21.84,True,1,4
Mini jupe sexy simili cuir...,18.48,True,1,4
Mini jupe sexy motif...,15.12,True,1,4
Jupe crayon sexy KouCla...,19.32,True,1,4
Mini jupe sexy simili cuir,15.12,True,3,3
Gilet KouCla sexy avec...,15.6,True,4,5
Mini jupe sexy plissée...,20.16,True,3,5
Mini jupe sexy plissée...,20.16,True,4,3
Jupe crayon sexy KouCla,15.12,True,4,3
Jupe crayon sexy effet...,18.48,True,2,1
Mini jupe basique sexy,11.76,True,2,3
Top latina sexy en dentelle...,5.1,True,5,3
Top KouCla sexy avec basque,6.0,True,5,1
Top sexy avec imprimé 'GEEK',6.0,True,2,3
Crop top sexy en similicuir,18.48,True,4,2
Leggings sexy avec imprimé,6.0,True,1,2
Leggings sexy look léopard...,6.0,True,2,1
Top sexy fils de velours et...,21.6,True,3,1
Robe fourreau sexy avec...,21.84,True,4,1
Mini robe sexy KouCla avec...,21.0,True,4,1
Robe sexy avec fente,21.84,True,4,1
Top sexy avec des découpes,9.6,True,4,1
Ensemble fashion sexy,13.2,True,4,1
Robe sexy pailletée,21.84,True,3,1
Pull en maille tendance...,19.2,True,5,1
Body sexy effet mouillé...,15.12,True,2,1
"Sexy KouCla Crop top ""I m...",3.3,True,5,3
Leggings tendance avec...,8.4,True,1,4
Bikini sexy,18.48,True,3,1
Combishort tendance,28.56,True,4,3
Sexy crop top Sportswear,8.4,True,3,1
Top à manches longues sexy...,13.44,True,10,3
Mini jupe sexy simili cuir,10.8,True,2,2
Blouse sexy avec décolleté...,14.4,True,3,4
Robe courte sexy en dentelle,18.0,True,6,3
Monokini Sexy extrême avec...,6.24,True,4,4
Jupe crayon sexy en simili...,20.16,True,2,4
Salopette sexy avec découpe...,30.24,True,4,1
Robe sexy avec rivets et...,25.2,True,3,1
Mini robe tendance gogo...,15.6,True,3,3
Monokini sexy avec des clous,6.6,True,3,3
Monokini sexy,7.2,True,2,4
Veste tendance,24.0,True,6,5
Treggings sexy avec dentelle,15.96,True,4,5
Mini jupe en similicuir sexy,15.96,True,1,5
Chemise cintrée sexy,12.0,True,8,1
Débardeur Sexy à fines...,3.6,False,8,4
Robe sexy KouCla au look marin,16.8,True,7,5
Robe sexy KouCla asymétrique,25.2,True,7,4
Top sexy tendance,15.96,True,7,2
Robe en maille sexy avec...,12.6,True,1,4
Top sexy KouCla en dentelle,14.28,True,6,2
Mini robe sexy avec des...,15.6,True,4,2
Top sexy en dentelle...,11.4,True,4,1
Mini robe de soirée sexy...,20.16,True,1,6
Jeans sexy,22.8,True,1,6
Pantacourt en jeans tendance,20.4,False,2,4
Top sexy en dentelle,15.12,True,6,4
Robe sexy cocktail,21.84,True,7,4
Veste sexy style motard...,28.8,True,3,4
Veste sexy en similicuir...,40.32,True,3,4
Veste de motard sexy avec...,40.32,True,3,4
Veste style motard sexy...,40.32,True,3,4
Veste sexy style motard...,30.0,True,3,4
Veste en similicuir sexy...,42.0,True,3,5
Pantalon skinny trendy avec...,16.2,True,6,4
Veste d'été sexy,20.4,True,7,4
Bikini sexy KouCla triangle...,6.6,True,8,5
Robe sexy en dentelle,25.2,True,5,3
Slip de bikini sexy KouCla...,6.72,True,7,4
Robe bustier sexy tendance,9.0,True,8,4
Robe bandeau sexy,18.0,True,7,5
Pantalon taille haute sexy...,21.84,True,3,4
Robe bustier sexy avec strass,23.52,True,6,4
Monokini tendance coupe en...,16.8,True,3,3
Monokini sexy bandeau avec...,6.6,True,7,5
Monokini sexy sans ventre...,16.8,True,4,1
Débardeur tendance Peace...,3.9,True,7,3
Robe bustier sexy tendance,21.84,True,9,1
Débardeur tendance 'Sexy'...,3.9,True,6,1
Débardeur sexy 'RockStar',3.9,True,7,4
Blouse sexy avec décolleté...,18.48,True,8,4
Robe sexy tendance avec...,18.0,True,6,4
Robe sexy bandeau avec clous,8.4,True,6,4
Monokini sexy avec clous,6.6,True,5,4
Robe sexy à manches fluides,25.2,True,5,3
Haut de bikini sexy ajustable,7.56,True,7,5
Bikini sexy avec bretelles...,13.8,True,4,3
Monokini sexy KouCla...,21.0,True,7,4
Robe sexy bustier tendance,26.88,True,8,4
Robe sexy avec son décolleté,20.16,True,6,4
Robe de soirée sexy avec...,14.4,True,7,5
Robe sexy en dentelle à...,18.0,True,5,4
Bikini sexy KouCla avec...,6.6,True,6,3
Combinaison en satin avec...,30.24,True,5,4
Bikini sexy avec imprimé,6.0,True,1,1
Crop top sexy tendance,9.24,True,9,4
Bikini sexy imprimé animal,6.0,True,6,4
Bikini sexy avec noeud,15.96,True,4,4
Bikini sexy avec dentelle,16.8,True,7,4
Corsage sexy avec strass,11.52,True,7,4
Bikini à balconnet sexy...,7.5,True,4,4
Bikini sexy à fils,7.8,True,6,5
Robe sexy en dentelle avec...,23.52,True,5,4
Bas de bikini sexy à nouer,7.56,True,2,4
Robe de cocktail sexy,8.4,True,5,1
Top sexy à nouer avec des...,8.4,True,4,4
Robe sexy tendance avec strass,25.2,True,9,1
Top sexy avec fermeture éclair,2.7,True,7,1
Débardeur avec nœud,3.6,False,7,1
Top sexy avec boucles en X,2.7,True,7,4
Robe sexy bandeau,15.6,True,5,4
Chemisier sexy aspect cuir...,15.6,True,4,3
Haut de bikini sexy tendance,7.56,True,7,1
Pull tendance col rond,14.4,True,10,1
Robe sexy bandeau transparente,18.48,True,9,3
Chemise sexy avec son dos nu,11.76,True,6,4
Body sexy fashion bicolore,12.0,True,6,3
Robe sexy KouCla avec dentelle,15.6,True,5,1
Débardeur sexy avec...,3.6,True,4,4
Robe en dentelle sexy,25.2,True,6,2
Sweat tendance avec dentelle,9.6,True,5,5
Robe sexy KouCla en dentelle,18.0,True,6,3
Bikini sexy avec clous,7.2,True,6,1
Crop top sexy à manches...,9.24,True,8,4
Blouse sexy avec broderie,21.84,True,4,3
Robe bandeau sexy avec noeud,7.8,True,7,3
Robe sexy tendance avec...,21.84,True,7,4
Crop top sexy,9.24,True,5,4
Blouse corsage 2 en 1 sexy...,21.84,True,5,1
Crop top sexy avec découpes,10.8,True,4,5
Robe sexy bicolore en dentelle,25.2,True,3,5
Pantalon sexy avec laçage...,25.2,True,4,4
Crop top sexy latina KouCla,13.44,True,6,3
Crop top sexy aspect cuir...,6.9,True,4,4
Robe sexy avec strass et...,25.2,True,4,4
Robe sexy en dentelle tendance,16.8,True,8,4
Robe sexy en dentelle tendance,21.0,True,5,4
Robe sexy tendance en dentelle,23.52,True,5,4
Crop top en latex sexy KouCla,12.6,True,5,1
Collant sexy à fines rayures,5.88,True,1,4
Blouse sexy KouCla avec...,18.48,True,5,4
Robe bustier cocktail sexy,16.8,True,6,1
Kimono à manches longues...,28.8,True,7,4
Mini robe sexy en latex,20.16,True,6,4
Mini robe sexy tendance...,21.84,True,7,4
Robe KouCla sexy avec dentelle,23.52,True,6,4
Robe sexy tendance,10.2,True,8,5
Robe de cocktail avec noeud...,9.0,True,4,3
Bikini sexy avec anneaux,10.56,True,6,4
Robe sexy fashion tendance,18.48,True,5,1
Mini robe sexy en tricot à...,15.12,True,7,1
Robe de soirée sexy à...,30.24,True,5,1
Mini-robe de soirée sexy,21.84,True,3,1
Mini-robe sexy avec...,23.52,True,3,1
Robe sexy look grec,36.96,True,3,3
Short taille haute sexy...,18.48,True,1,1
Mini robe en tricot sexy...,9.6,True,5,1
Top sexy imprimé FAME,6.0,True,2,4
Robe sexy bustier en  dentelle,9.0,True,7,4
Mini robe sexy asymétrique,23.52,True,7,1
Top sexy avec broderie,10.08,True,5,4
Robe sexy avec des pierres...,23.4,True,5,4
Robe sexy imprimé fleuri et...,20.16,True,4,1
Crop top sexy à épaules...,16.8,True,6,1
Ensemble tendance,30.24,True,6,2
Robe longue sexy,21.84,True,1,4
Blouse sexy à lier dos nu,20.16,True,8,1
Pantalon en cuir taille...,23.52,True,7,4
Robe bustier sexy avec pierres,20.16,True,4,3
Monokini sexy tendance,15.12,True,5,5
Treggings sexy KouCla...,16.8,True,4,1
Crop top sexy aux épaules...,9.24,True,7,3
Bikini sexy tendance fashion,6.3,True,6,4
Pantalon sexy avec zips,25.2,True,3,5
Short jeans sexy taille haute,19.32,True,3,4
Short taille haute avec poches,15.12,True,5,4
Bustier sexy avec pierres...,16.8,True,4,3
Bikini triangle sexy avec...,9.6,True,5,4
Monokini sexy KouCla avec...,6.6,True,4,4
Pantalon sexy en simili...,18.0,True,5,2
Crop top sexy avec...,10.92,True,8,4
Combishort sexy KouCla,23.52,True,5,4
Top sexy avec dentelle KouCla,18.48,True,5,4
Top sexy avec strass tendance,12.6,True,6,3
Bikini avec coussinets...,15.12,True,5,1
Top sexy,6.6,False,4,4
Pantalon sexy avec chaînes,14.4,True,2,4
Pantalon sexy avec ceinture...,13.39,True,4,1
Mini robe sexy avec dos nu,20.16,True,3,4
Pantalon sexy KouCla Business,7.2,True,5,1
Mini robe sexy bandeau avec...,6.6,True,7,3
Crop top sexy en latex,12.6,True,5,1
Mini robe sexy en tricot...,26.4,True,5,4
Robe courte sexy à manches...,23.52,True,3,3
Robe longue scintillante...,30.24,True,2,3
Robe longue sexy à col...,26.88,True,2,1
Mini robe sexy avec découpes,15.12,True,4,4
Pantalon sexy simili cuir...,23.52,True,4,4
Mini jupe sexy simili cuir,16.8,True,3,4
Mini jupe sexy simili cuir...,15.12,True,3,1
Pull large tendance en...,15.6,True,6,1
Crop top sexy à manches...,10.92,True,3,1
Crop top sexy look latino,13.44,True,5,1
Pull à capuche tendance en...,10.8,True,6,1
Robe sexy en maille KouCla...,16.8,True,5,1
T-shirt sexy col en V,4.8,True,7,1
Débardeur sexy KouCla motif...,3.6,False,8,1
Débardeur tendance KouCla...,3.9,True,7,1
Débardeur sexy 'KouCla...,3.3,True,8,1
Crop top sexy sans ventre...,9.0,True,7,2
T-shirt manches courtes...,6.0,True,8,3
Body sexy avec bas du dos nu,6.0,True,2,1
T-shirt avec traîne...,4.5,True,6,1
T-shirt long sexy...,4.2,True,6,1
Top court sexy KouCla dos...,3.3,True,6,1
Top Koucla avec dos sexy,4.5,True,4,1
Crop top sexy à volants,7.8,True,4,4
Jupe d'affaires sexy avec...,18.0,True,4,3
Mini jupe sexy à boutons,12.0,True,4,4
Jupe d'affaires sexy KouCla...,17.16,True,3,4
Jupe crayon sexy KouCla...,7.2,True,2,4
Jupe crayon sexy KouCla...,16.8,True,4,3
Mini jupe culotte 2 en 1 sexy,13.2,True,5,4
Jupe crayon sexy,15.6,True,6,4
Jupe crayon sexy KouCla...,8.4,True,4,1
Pull chauve-souris tendance,15.6,True,8,1
Pull chauve-souris tendance...,16.8,True,8,1
Crop top bandeau sexy avec...,3.3,True,10,1
Crop top sexy avec traîne dos,9.54,True,5,1
Crop top sexy KouCla...,6.24,True,3,2
Crop top sexy KouCla avec...,10.8,True,9,1
Débardeur KouCla sexy avec...,6.6,True,11,1
T- shirt transparent sexy...,12.96,True,9,1
Bustier bandeau sexy avec...,5.4,False,9,1
Crop top sexy à manches...,4.5,True,6,1
Mini robe sexy KouCla avec...,6.0,True,7,1
Top à motif serpent sexy +...,11.4,True,2,3
Short 2 en 1 sexy en...,10.8,True,4,4
Treggings sexy avec aspect...,18.0,True,2,3
Bustier sexy avec dentelle,13.44,True,5,4
Pantalon sexy avec aspect cuir,12.48,True,4,4
Treggings sexy avec clous...,12.65,True,3,4
Pantalon skinny sexy,16.8,True,2,4
Treggings sexy avec...,16.8,True,1,4
Treggings sexy avec...,16.85,True,2,4
Treggings tendance avec...,16.8,True,2,3
Leggings sexy en similicuir...,15.6,True,2,1
"T-shirt tendance ""SEXY...",3.9,True,7,2
T-shirt rayures sexy avec...,5.04,True,8,1
T-shirt manches longues...,3.9,False,4,1
Pull sexy 2en1 rayé,12.38,True,6,1
Robe sexy en tricot avec...,7.8,True,7,1
Pull court en maille fine...,7.92,True,6,1
Cardigan en grosse maille...,20.16,True,6,4
Treggings sexy avec...,18.0,True,2,1
Robe sexy GoGo simili cuir...,9.36,True,3,1
Robe sexy GoGo simili cuir...,12.0,True,7,1
Robe sexy GoGo simili cuir...,18.0,True,4,1
Ensemble GoGo sexy avec...,23.52,True,6,1
Mini robe sexy GoGo simili...,21.84,True,6,1
Mini robe sexy Koucla Gogo...,15.0,True,4,1
Mini robe sexy GoGo avec...,14.4,True,4,1
Mini robe sexy GoGo avec...,16.8,True,2,1
Top sexy GoGo simili cuir...,6.6,True,5,1
Ensemble gogo sexy effet...,12.6,True,3,1
Short sexy GoGo simili cuir...,8.4,True,5,1
Caches jambes sexy GoGo en...,7.2,True,5,1
Mini robe sexy GoGo  simili...,21.84,True,6,1
Mini robe sexy GoGo à...,15.6,True,6,2
Mini robe sexy GoGo avec...,20.16,True,7,3
Mini robe sexy KouCla GoGo...,25.2,True,2,3
Mini robe sexy KouCla Gogo...,21.84,True,5,3
Crop top sexy KouCla effet...,12.6,True,2,4
Débardeur sexy KouCla effet...,9.24,True,2,3
Leggings sexy KouCla effet...,14.28,True,1,1
Robe KouCla sexy effet...,30.24,True,2,3
Jupe sexy aspect cuir avec...,12.6,True,1,4
Veste courte en jeans tendance,30.67,True,1,5
Veste en similicuir sexy...,42.0,True,1,5
Doudoune courte tendance...,49.42,True,4,1
Cardigan sexy XXL en maille,20.4,True,5,1
Cardigan KouCla sexy avec...,21.84,True,5,4
Blazer sexy KouCla ajusté...,25.2,True,2,2
Leggings KouCla sexy,15.12,True,7,1
Mini robe sexy avec...,12.6,True,2,4
Mini robe bandeau sexy à...,7.8,True,5,1
Robe de cocktail sexy avec...,7.8,True,4,1
Crop top sexy en denim,18.48,True,2,5
Jeans tendance,21.84,True,5,3
Haut de bikini triangle...,6.72,True,7,4
Mini robe bandeau sexy avec...,24.12,False,3,4
Mini robe sexy avec basque,8.4,True,6,2
Mini robe de soirée sexy à...,8.4,True,8,1
Mini robe sexy avec cache...,9.0,True,9,1
Mini robe sexy KouCla avec...,8.4,True,8,1
Mini robe sexy KouCla avec...,8.4,True,7,4
Robe de cocktail sexy...,9.0,True,7,1
Mini robe de cocktail sexy...,7.2,True,6,5
Jeans sexy avec impression...,21.6,True,1,5
Jeans skinny sexy KouCla...,24.0,True,3,5
Short en jeans destroy sexy...,20.4,True,3,6
Jeans  destroy sexy Look...,22.8,True,2,5
jeans skinny sexy destroy...,24.0,True,2,1
Haut de soirée sexy avec...,31.92,True,3,3
Leggings sexy aspect...,7.8,True,2,3
Leggings sexy à imprimé...,6.0,True,2,2
Leggings sexy en dentelle...,13.44,True,3,4
Jeans KouCla sexy,21.6,True,1,4
Short sexy KouCla avec...,16.85,True,4,4
Short sexy KouCla avec...,16.8,True,5,1
Maillot sexy à manches courtes,4.2,True,7,5
Short en jeans sexy à 5 poches,17.64,True,1,1
Jupe-short sexy taille...,16.8,True,4,1
Crop top sexy col bardot,20.4,True,4,3
Short sexy Denim taille...,20.16,True,2,3
Mini robe sexy transparente...,12.38,True,19,5
Jeans skinny sexy destroy...,21.6,True,1,5
Jeans skinny sexy destroy...,21.84,True,1,1
Mini robe sexy manche...,6.0,True,5,1
Mini robe sexy dos nu,5.4,True,5,1
Mini robe sexy col et...,9.36,True,4,4
Robe sexy avec dentelle et...,25.2,True,5,4
Top Koucla sexy avec...,10.8,True,6,4
Robe Koucla tendance avec zip,9.0,True,3,4
Mini robe sexy KouCla avec...,6.9,True,5,3
Top tendance avec...,12.08,True,5,3
Robe droite sexy avec col...,9.0,True,6,4
Robe droite sexy avec...,9.0,True,5,5
Élégante robe crayon...,8.4,True,7,1
Mini robe sexy froncée,23.18,True,3,1
Robe longue ajourée sexy...,30.67,True,4,4
Robe d'été sexy KouCla avec...,24.12,True,3,1
Mini robe fronçée sexy avec...,8.4,True,8,1
Mini robe bandeau sexy...,7.8,True,7,1
Top sexy gogo au look araignée,10.2,True,4,1
Top sexy gogo au look araignée,10.2,True,2,4
Pantalon sexy avec paillettes,17.71,True,7,4
Pantalon sexy avec paillettes,16.32,True,9,4
Robe bandeau sexy avec...,23.18,True,7,1
Robe bandeau sexy avec...,6.0,True,3,4
Robe de soirée bandeau sexy...,23.52,True,10,1
Robe de soirée sexy avec...,6.6,True,7,2
Body sexy à épaules dénudées,9.6,True,5,3
Bikini sexy avec strass,10.56,True,2,2
Débardeur sexy avec imprimé...,4.5,True,7,1
Top sexy sans dos avec...,12.6,True,5,1
Débardeur tendance avec...,3.9,True,5,4
Crop top sexy à manches...,12.0,True,1,2
Crop top sexy avec zip,8.4,True,4,1
Top transparent sexy avec...,11.93,True,6,1
Top portefeuille sexy,12.0,True,7,2
Crop top sexy bi couleur,5.1,True,7,1
Top tendance KouCla,9.24,True,7,1
Top sexy tendance fashion,9.24,True,12,3
Crop top sexy en dentelle,18.48,True,3,3
Top bandeau sexy KouCla...,12.1,True,4,1
Débardeur court sexy KouCla,8.4,True,5,1
Top KouCla sexy avec laçage...,4.8,False,9,2
"Débardeur sexy  ""One and Only""",5.4,True,2,1
Débardeur sexy KouCla avec...,3.9,True,6,1
Débardeur Sexy couleur unie,6.72,True,11,4
Top Koucla sexy avec basque,12.6,True,5,3
Crop top sexy KouCla,12.6,True,6,2
Top court sexy KouCla...,12.6,True,8,1
Crop top sexy,10.92,True,3,1
Top sexy KouCla avec strass...,12.6,True,6,1
Crop top sexy avec dentelle...,16.8,True,5,2
Crop top sexy,10.92,True,3,1
Top Bandeau sexy KouCla...,3.9,True,7,1
Crop top sexy effet mouillé,9.24,True,2,3
Top sexy avec dentelle au...,5.4,True,5,1
Top sexy avec broderie,10.08,True,10,2
Top court coupe sexy avec...,14.28,True,3,1
Top élégant avec basque et...,6.0,True,5,2
Top Koucla élégant avec...,5.4,True,5,1
Top bustier sexy effet satin,10.08,True,2,1
Top sexy à bretelles spaghetti,9.24,True,7,3
Top Koucla sexy avec des...,5.7,True,5,1
Top bustier avec ornement,5.7,True,6,1
Crop top sexy effet mouillé,13.44,True,5,1
Crop top sexy à épaules...,9.24,True,7,1
Top court sexy avec...,11.76,True,5,1
Top court KouCla sexy,12.6,True,5,1
Top sexy avec basque et...,5.7,True,5,1
Top sexy transparent avec...,16.8,True,4,3
Top en dentelle sexy avec...,7.2,True,7,3
Débardeur sexy effet...,13.44,True,2,1
Top de soirée sexy,12.6,True,8,4
Crop top sexy KouCla avec...,10.92,True,3,3
Crop top sexy effet mouillé...,11.76,True,1,3
Top de soirée sexy effet...,15.12,True,5,1
Crop top sexy,16.8,True,3,1
Top sexy avec broderie,13.44,True,7,1
Top sexy en filet fluo,3.9,True,3,4
Top bandeau sexy avec...,5.7,True,5,1
Crop top sportswear sexy...,9.24,True,3,2
Crop top sportswear tendance,5.04,True,5,1
Crop top sexy à manches...,10.92,True,7,1
Top en dentelle sexy avec...,14.4,True,3,1
Crop Top Sexy manches longues,13.44,True,5,1
Crop top sexy décolleté en...,17.64,True,2,1
Top à col roulé tendance...,14.28,True,9,1
Combishort en tricot...,18.48,True,5,3
Leggings taille haute tendance,10.92,True,7,5
Short jeans tendance,18.48,True,1,1
Top gogo sexy,9.6,True,8,2
T-shirt sexy KouCla avec...,4.2,True,7,1
T-shirt gogo transparent sexy,15.12,True,7,2
T-shirt sexy rayé avec...,4.2,True,8,2
T-shirt sexy rayé avec des...,4.2,False,8,6
Jeans skinny sexy taille haute,21.6,True,1,6
Jeans skinny sexy,22.8,True,1,4
Top sexy avec décolleté et...,9.6,True,5,4
Sweat-shirts sexy dentelle...,14.28,True,7,4
Mini robe bandeau sexy avec...,10.8,True,7,4
Robe de cocktail sexy...,18.0,True,7,1
Mini robe sexy,15.6,True,8,1
Robe sexy asymétrique avec...,23.04,True,8,4
Short KouCla sexy,5.4,True,5,4
Mini robe bandeau sexy à...,18.0,True,7,4
Shorts sexy KouCla taille...,13.44,True,1,1
Shorts sexy classique,5.88,True,11,1
Mini robe bandeau sexy avec...,4.5,True,3,1
Robe de soirée bandeau sexy...,9.36,True,6,1
Mini robe bandeau sexy,7.2,True,8,1
Robe asymétrique sexy en...,8.4,True,8,1
Robe de soirée sexy en...,7.2,True,6,1
Robe bandeau sexy,18.0,True,5,1
Robe sexy bretelle asymétrique,15.6,True,6,1
Mini robe sexy avec...,10.08,True,6,1
Mini robe bandeau sexy avec...,10.8,True,6,3
Robe de soirée sexy avec...,6.0,True,7,3
Robe bandeau sexy avec des...,15.6,True,6,1
Crop top sexy,5.88,True,7,1
Sweat-shirts sexy à manches...,13.44,True,7,1
Robe sexy à paillettes avec...,23.18,True,6,1
Pull chauve souris Koucla...,12.38,True,6,1
Pull chauve souris sexy...,12.38,True,5,2
Sweat-shirts sexy,14.28,True,6,1
Pull tendance Koucla avec...,9.36,True,5,1
Pull tendance avec...,12.38,True,5,1
Pull court KouCla sexy avec...,12.38,True,6,1
Mini robe sexy KouCla...,7.2,True,5,3
Mini jupe sexy en jeans...,12.0,True,5,2
T-shirt sexy KouCla avec...,8.4,False,11,2
T-shirt sexy KouCla avec...,3.6,False,8,2
"T-shirt sexy KouCla "" Never...",9.6,True,11,2
T-shirt sexy KouCla avec...,3.9,True,11,1
Mini robe sexy avec boucle...,20.59,True,7,3
Treggings sexy aspect cuir,19.2,True,1,1
Robe de soirée sexy...,10.8,True,3,1
Mini robe bandeau sexy...,18.0,False,5,1
Mini robe sexy avec tour de...,5.7,True,3,3
Mini robe sexy asymétrique...,7.8,True,6,1
Mini robe sexy avec ceinture,18.0,False,7,1
Mini robe sexy froncée...,12.29,True,7,1
Mini robe sexy asymétrique...,9.36,True,6,1
Mini robe de soirée sexy...,7.8,True,6,4
Jupe crayon sexy avec...,7.8,True,12,1
Mini robe sexy avec...,7.2,True,8,1
Mini robe sexy bandeau,6.6,True,3,1
Robe de soirée sexy à nouer...,7.2,False,4,3
Monokini sexy avec boucles,11.04,True,7,3
Bikini sexy avec strass,11.04,True,6,3
Bikini sexy avec boucles,10.56,True,6,3
Bikini bandeau sexy avec...,11.52,True,5,3
Bikini sexy avec fines...,10.56,False,4,3
Bikini sexy avec imprimé...,9.6,True,6,3
Bikini sexy à nouer imprimé...,10.56,True,5,1
Mini robe bandeau sexy...,7.8,True,2,2
Mini robe sexy manche...,7.8,True,7,1
Mini robe sexy avec noeud...,7.2,True,6,1
Mini robe de soirée sexy...,6.0,False,2,4
Jupe crayon taille haute...,9.0,True,6,4
Mini jupe sexy business...,6.6,True,6,4
Pantalon KouCla sexy avec...,16.8,True,2,4
Pantalon sexy avec imprimé...,16.32,True,4,4
Pantalon KouCla sexy clouté,16.32,True,4,4
Pantalon KouCla sexy avec...,13.39,True,4,4
Pantalon sexy clouté avec...,16.32,True,2,4
Mini jupe sexy avec clous...,12.0,True,5,4
Short sexy koucla taille...,15.6,True,4,4
Leggings Sexy Skinny KouCla,18.0,True,6,4
Pantalon sexy KouCla coupe...,15.6,True,6,2
Crop top sexy en dentelle à...,16.8,True,2,4
Monokini sexy,10.8,True,4,5
Bikini sexy,10.8,True,3,5
Bikini taille Haute imprimé...,10.8,True,4,4
"Bikini bi-couleur sexy,...",10.8,True,3,3
Bikini sexy,12.6,True,3,1
Mini robe sexy KouCla,21.0,True,2,4
Pantalon skinny Look Biker...,18.0,True,1,4
Pantalon sexy en similicuir...,18.0,True,1,4
Pantalon sexy KouCla avec...,18.0,True,3,5
